Chimes Restaurant,Chimes Restaurant Baton Rouge,,https://thechimes.com/,3357 Highland Rd,,United States,US,,,Louisiana,LA,Baton Rouge,,,,70802,,,(225) 383-1754,The Chimes Restaurant & Tap Room has been a Baton Rouge and LSU tradition serving fine patrons for over 25 years.,"The Chimes Restaurant & Tap Room has been a Baton Rouge and LSU tradition serving fine patrons for over 25 years. We have continued to grow and have brought this tradition to our second location in Baton Rouge, a third location in Covington, and now a fourth, located in Lafayette. Our goal is to provide a relaxed, family friendly experience while serving the best made-from-scratch menu possible. We take pride in having one of the most extensive beer and liquor selections available. Thank you for your continued support, we look forward to seeing you soon!",,,12/31/2050,Active,Silver,Restaurants->Southern,Restaurants->Cajun/Creole,Nightlife->Bars,,,New Listing Template,,,,,,,,,,,,,,,,
Rickochet Billards,Rickochet Billards Prairieville,tinag@rickochets.com,https://www.rickochets.com/,17540 Airline Hwy,,United States,US,,,Louisiana,LA,Prairieville,,,,70769,,,(225) 313-4008,"Rickochet's Prairieville is a Bar and Billiards Hall with (6) 7 ft. Diamond Smart tables & (4) 8 ft. Brunswick tables. We also carry arcade darts, golf, and bowling! Fun, Friendly Atmosphere! We are a Non smoking establishment and proper dress is required.",Rickochet's Prairieville is a bar and billiards hall offering a fun and friendly atmosphere with various games and the best bar food in town. They host leagues and tournaments and have happy hour drink specials. Must be 21+ to enter.,,,12/31/2050,Active,Silver,Nightlife->Pool Halls,,,,,New Listing Template,,,,,,,,,,,,,,,,
Deuce’s Bar and Lounge,Deuce’s Bar and Lounge Baton Rouge,,,3575 N Acadian Thruway,,United States,US,,,Louisiana,LA,Baton Rouge,,,,70805,,,(225) 278-0556,,,,,12/31/2050,Active,Silver,Nightlife->Bars,,,,,New Listing Template,,,,,,,,,,,,,,,,
Comedy Plus Network,Comedy Plus Network Baton Rouge,,,,,United States,US,,,Louisiana,LA,Baton Rouge,,,,70820,,,(818) 720-8565,,,,,12/31/2050,Active,Silver,Arts & Entertainment,Nightlife->Comedy Clubs,Professional Services->Video/Film Production,,,New Listing Template,,,,,,,,,,,,,,,,
The Kingfish Grill,The Kingfish Grill Baton Rouge,info@kingfishgrill.com,https://www.kingfishgrill.com/,201 Lafayette St,,United States,US,,,Louisiana,LA,Baton Rouge,,,,70801,,,(225) 344-5866,"The Best Fresh Fish on the Water! Located minutes from downtown St. Augustine, Florida.","Kingfish Grill was established in June 2005 by owner Paul Mackey. Originally from coastal New England, the restaurateur has a passion for seafood, using his background & upbringing to contribute to the flare and spice at Kingfish Grill. The team at Kingfish Grill have made it a favorite restaurant among locals and visitors alike. We invite you to come share our excitement of great food, great service & spirits!",,,12/31/2050,Active,Silver,Nightlife->Bars,Restaurants->New American,Restaurants->Buffets,,,New Listing Template,,,,,,,,,,,,,,,,
X Bio Discotec,X Bio Discotec Baton Rouge,Osman78@hotmail.com,https://www.facebook.com/XBIODISCOTEC/,11690 Florida Blvd,,United States,US,,,Louisiana,LA,Baton Rouge,,,,70815,,,(225) 916-2180,Haciendo la diferencia Baton Rouge,,,,12/31/2050,Active,Silver,Arts & Entertainment->Music Venues,,,,,New Listing Template,,,,,,,,,,,,,,,,
City Pork Perkins,City Pork Perkins Baton Rouge,,https://www.citypork.com/,18143 Perkins Rd E,,United States,US,,,Louisiana,LA,Baton Rouge,,,,70810,,,(225) 998-0744,"Unmistakingly ""Louisianan"" elevated cuisine & award-winning bbq gulf seafood. Offering Weekday Breakfast , & Lunch , Dinner & Weekend Brunch.","It all started with City Pork Deli back in the day and has grown into 2 restaurants with a full service catering department. Still serving amazing sandwiches, City Pork has added to the menu to include southern favors for everyone. City Pork and City Group Hospitality believe in sourcing locally and celebrating the flavors which make Baton Rouge culinary scene special. City Pork house smokes our meats and you can taste the time and love put into it!",,,12/31/2050,Active,Silver,Restaurants->Breakfast & Brunch,Restaurants->Barbeque,Nightlife->Bars->Cocktail Bars,,,New Listing Template,,,,,,,,,,,,,,,,
Cheba Hut Toasted Subs,Cheba Hut Toasted Subs Baton Rouge,batonrouge-benhur@chebahut.com,https://www.facebook.com/ChebaHutBatonRouge/,411 Ben Hur Rd,,United States,US,,,Louisiana,LA,Baton Rouge,,,,70820,,,(225) 256-3603,"Cheba Hut is a ""toasted"" sub sandwich shop with a full bar.","Cheba Hut is a ""toasted"" sub sandwich shop with a full bar. We pride ourselves in providing a laid back vibe and some of the best sub sandwiches you have ever experienced.",,,12/31/2050,Active,Silver,Restaurants->Sandwiches,Nightlife->Bars,,,,New Listing Template,,,,,,,,,,,,,,,,
Locals Bar and Kitchen,Locals Bar and Kitchen Denham Springs,,,7755 Magnolia Beach Rd,,United States,US,,,Louisiana,LA,Denham Springs,,,,70726,,,(225) 380-5555,,,,,12/31/2050,Active,Silver,Nightlife->Bars->Sports Bars,Restaurants->American,,,,New Listing Template,,,,,,,,,,,,,,,,
Mom's Place,Mom's Place Prairieville,,https://www.facebook.com/UncleBuddys?__tn__=-UC*F,42028 Highway 42,,United States,US,,,Louisiana,LA,Prairieville,,,,70769,,,(225) 622-1682,Mom's Place lunch special for February 12,"Goodmorning! This is what we will have on our lunch specials today, if youâd like to make a Togo order you can call 580-798-6473. Have a great day!!",,,12/31/2050,Active,Silver,Nightlife,,,,,New Listing Template,,,,,,,,,,,,,,,,
MonteCristo Cigar Bar & Bistro,MonteCristo Cigar Bar & Bistro Baton Rouge,MonteCristo.br.events@gmail.com,https://www.facebook.com/p/MonteCristo-Cigar-Bar-Bistro-BR-100083071845204/,7808 Howell Blvd,,United States,US,,,Louisiana,LA,Baton Rouge,,,,70807,,,(225) 256-1761,Cigar Bar/Lounge & Bistro,"MonteCristo Cigar Bar & Bistro - BR is a cigar bar and bistro located in Baton Rouge, LA. They host various events, including crawfish & chill nights, after-parties, and themed mixers. They offer drink specials and have a mature and sophisticated atmosphere.",,,12/31/2050,Active,Silver,Nightlife->Bars->Lounges,Nightlife->Bars->Cigar Bars,,,,New Listing Template,,,,,,,,,,,,,,,,
Urban Daiquiris,Urban Daiquiris Prairieville,URBANDAIQUIRIS@GMAIL.COM,https://urbandaiquiris.com/,17497 Airline Hwy,,United States,US,,,Louisiana,LA,Prairieville,,,,70769,,,(225) 480-2222,"Urban Daiquiris is opening a new location in Prairieville, Louisiana.","Urban Daiquiris is opening a new location in Prairieville, Louisiana. The grand opening is August 4th & 5th. They are actively interviewing for bar experienced workers.",,,12/31/2050,Active,Silver,Nightlife->Bars->Sports Bars,Nightlife->Bars->Cocktail Bars,Nightlife->Karaoke,,,New Listing Template,,,,,,,,,,,,,,,,
Tsunami Sushi Highland BR,Tsunami Sushi Highland BR Baton Rouge,tsunami.highlandbr@servingsushi.com,https://highland.servingsushi.com/baton-rouge-tsunami-highland-br-about,1 Smart Wy,,United States,US,,,Louisiana,LA,Baton Rouge,,,,70810,,,(225) 497-2424,"Tsunami Sushiâs second Baton Rouge location, located at the corner of Highland Rd and Bluebonnet Blvd. The menu focuses on fresh seafood and diverse Asian dishes, blending Japanese and Eastern flavors with Southern roots.","Tsunami Sushiâs second Baton Rouge location, Tsunami Highland (2024), is located at the corner of Highland Rd and Bluebonnet Blvd. It aims to expand the culinary legacy of Tsunami while maintaining the brand. The menu focuses on fresh seafood and diverse Asian dishes, blending Japanese and Eastern flavors with Southern roots. The menu offers standard sushi rolls, nigiri and sashimi, and grilled fish, chicken, and pork.",,,12/31/2050,Active,Silver,Nightlife->Bars,Restaurants->Sushi Bars,Restaurants->Tapas/Small Plates,,,New Listing Template,,,,,,,,,,,,,,,,
Mom’s Bar,Mom’s Bar Prairieville,,,42028  HWY 42,,United States,US,,,Louisiana,LA,Prairieville,,,,70769,,,(225) 290-1250,,,,,12/31/2050,Active,Silver,Nightlife->Bars->Dive Bars,Nightlife->Bars->Beer Bar,,,,New Listing Template,,,,,,,,,,,,,,,,
Bayou Billards,Bayou Billards Baton Rouge,bayoubilliards@yahoo.com,https://www.facebook.com/bayoubilliards,10090 Florida Blvd,,United States,US,,,Louisiana,LA,Baton Rouge,,,,70815,,,(225) 275-9114,We're just an old Billiards hall who will treat you like family and maybe even set up a game for you,,,,12/31/2050,Active,Silver,Nightlife->Pool Halls,,,,,New Listing Template,,,,,,,,,,,,,,,,
Chocolate City Sports Bar And Lounge,Chocolate City Sports Bar And Lounge Baton Rouge,,https://www.facebook.com/p/Chocolate-City-Sports-Bar-Lounge-llc-100083297322613/,4961 Gus Young Ave,,United States,US,,,Louisiana,LA,Baton Rouge,,,,70802,,,(225) 442-4176,"Sports bar and lounge in Baton Rouge, LA.","Chocolate City Sports Bar & Lounge llc. in Baton Rouge, LA. It is categorized as a bar.",,,12/31/2050,Active,Silver,Nightlife->Bars->Lounges,Nightlife->Bars->Sports Bars,,,,New Listing Template,,,,,,,,,,,,,,,,
Jolie Pearl Oyster Bar,Jolie Pearl Oyster Bar Baton Rouge,,https://joliepearloysterbar.modihost.com/,315 N Blvd,,United States,US,,,Louisiana,LA,Baton Rouge,,,,70801,,,(225) 615-7172,"Jolie Pearl Oyster Bar is a restaurant in Baton Rouge, Louisiana.","The page provides contact information for Jolie Pearl Oyster Bar, including their address (315 North Boulevard, Baton Rouge, LA 70801), phone number (225-615-7172), summer hours, and links to their social media profiles. It also mentions that they offer lunch/dinner, cocktails/beer/wine, catering, and private event options. The page encourages visitors to reach out for more information about the restaurant, specific events, or job opportunities.",,,12/31/2050,Active,Silver,Restaurants->Cajun/Creole,Restaurants->Seafood,Nightlife->Bars->Cocktail Bars,,,New Listing Template,,,,,,,,,,,,,,,,
Tiger Sports Bar,Tiger Sports Bar Baton Rouge,,https://www.facebook.com/TigerSportsBar/,826 O'neal Ln,,United States,US,,,Louisiana,LA,Baton Rouge,,,,70816,,,(225) 272-7595,"Tiger Sports Bar is Baton Rougeâs neighborhood bar with 14 HD TVs, 4 Diamond Pool Tables, etcâ¦","Tiger Sports Bar is Baton Rougeâs neighborhood bar with 14 HD TVs, 4 Diamond Pool Tables, etcâ¦",,,12/31/2050,Active,Silver,Nightlife->Bars->Sports Bars,Nightlife->Pool Halls,,,,New Listing Template,,,,,,,,,,,,,,,,
Palermo Ristorante,Palermo Ristorante Baton Rouge,,http://palermobr.com/,7809 Jefferson Hwy A,,United States,US,,,Louisiana,LA,Baton Rouge,,,,70809,,,(225) 246-8358,"A delightful blend of classic and Modern.Authentic.Italian. â right in the heart of Baton Rouge, near Towne Center/Bocage. Intimate dining, exceptional service, handcrafted cocktails, and genuine Italian wines.","Discover a delightful blend of classic and Modern.Authentic.Italian. â right in the heart of Baton Rouge, near Towne Center/Bocage. Stop in and enjoy our exquisite Italian fare, prepared Ã  la minute (prepared to order) featuring a light, tasteful menu. We boast intimate dining, exceptional service, handcrafted cocktails, and genuine Italian wines. Full-service bar and outside patio dining. Reservations are recommended. WAITR Delivery is available.",,,12/31/2050,Active,Silver,Restaurants->Italian,Restaurants->Pizza,Nightlife->Bars->Cocktail Bars,,,New Listing Template,,,,,,,,,,,,,,,,
Playboy's Lounge,Playboy's Lounge Port Allen,,,4011 Mulatto Bend Rd,,United States,US,,,Louisiana,LA,Port Allen,,,,70767,,,(225) 383-2082,,,,,12/31/2050,Active,Silver,Nightlife,,,,,New Listing Template,,,,,,,,,,,,,,,,
Spoke & Hub,Spoke & Hub Baton Rouge,,,5412 Government St,,United States,US,,,Louisiana,LA,Baton Rouge,,,,70806,,,(225) 529-3550,,,,,12/31/2050,Active,Silver,Restaurants->Breakfast & Brunch,Nightlife->Bars,Restaurants->Southern,,,New Listing Template,,,,,,,,,,,,,,,,
Firehaus - Baton Rouge,Firehaus - Baton Rouge Baton Rouge,,https://www.firehausbr.com/,1700 Government St,,United States,US,,,Louisiana,LA,Baton Rouge,,,,70802,,,,"A cashless wine bar, indoor/outdoor lounge, and rooftop oasis in Baton Rouge.","Welcome to Firehaus, Baton Rouge's fiery hotspot for wine enthusiasts and social butterflies. As a cashless wine bar, indoor/outdoor lounge, and rooftop oasis, we're igniting the scene with our fiery ambiance and curated selection of fine wines. Join us for an unforgettable experience where flames of flavor and sparks of excitement collide.",,,12/31/2050,Active,Silver,Nightlife->Bars->Wine Bars,Nightlife->Bars->Lounges,,,,New Listing Template,,,,,,,,,,,,,,,,
Baby 4,Baby 4 Baton Rouge,,https://www.instagram.com/lalo/,,,United States,US,,,Louisiana,LA,Baton Rouge,,,,70815,,,(225) 933-0148,Photographer | Director Based in NYC Represented by @bransch_nyc,,,,12/31/2050,Active,Silver,Arts & Entertainment->Music Venues,,,,,New Listing Template,,,,,,,,,,,,,,,,
ESPN BET Sportsbook,ESPN BET Sportsbook Baton Rouge,lbr.guestexperience@pngaming.com,https://www.lbatonrouge.com/casino/sportsbook/,777 L'auberge Ave,,United States,US,,,Louisiana,LA,Baton Rouge,,,,70820,,,(225) 224-4122,"ESPN BETâ¦ Baton Rouge's home for sports! Bet on and watch your favorite teams on our big screens. Plus, grab a burger and an ice-cold pint. Get ready to bring your crew for all the game-day action!","ESPN BET at L'Auberge Casino Hotel Baton Rouge is the premier destination for sports enthusiasts in Baton Rouge. It offers a comprehensive sports betting experience with big screens for viewing games, a variety of betting options, and a dining area serving burgers and drinks. Over 20 Sports Betting Kiosks Available 24/7!",,,12/31/2050,Active,Silver,Restaurants->American,Restaurants->Chicken Wings,Nightlife->Bars->Sports Bars,,,New Listing Template,,,,,,,,,,,,,,,,
Suthern Kumfort's Gentleman's Club,Suthern Kumfort's Gentleman's Club Prairieville,,,17807 Airline Hwy,,United States,US,,,Louisiana,LA,Prairieville,,,,70769,,,(225) 673-6541,,,,,12/31/2050,Active,Silver,Nightlife->Dance Clubs,,,,,New Listing Template,,,,,,,,,,,,,,,,
New Orleans Original Daiquiris,New Orleans Original Daiquiris Geismar,,https://nolaoriginal.com/,13375 Hwy 73,,United States,US,,,Louisiana,LA,Geismar,,,,70734,,,(225) 313-3262,The original (and best) New Orleans FROZEN DAIQUIRIS since 1983. A friendly and welcoming spot where our neighbors could stop by to grab a frozen drink and kick back.,"We started out in 1983. Our goal was to offer a friendly and welcoming spot where our neighbors could stop by to grab a frozen drink and kick back. Little did we know we were paving the way for a frozen drink trend that would shape a category and become part of Louisiana local culture. David Briggs Jr. was the mastermind behind this phenomenonâpassing out samples on Bourbon Street, and innovating the craft with a chilling machine that made our frozen daiquiris instantly available. We brought the Big Freezy to the Big Easy, dat is. Through the 80s and 90s, we opened up new spots around the New Orleans metropolitan area and expanded to the suburbs and Baton Rouge. Youâre sure to find a NOLA Original down the road or around your neighborhood. When Hurricane Katrina hit us all pretty bad back in 2005, we quickly reopened our stores to help kickstart the city's economy. It turns out New Orleans isnât the only place that appreciates a good drink. From a few chilling machines, weâre now close to 50 locations across Louisiana.",,,12/31/2050,Active,Silver,Nightlife->Bars->Sports Bars,,,,,New Listing Template,,,,,,,,,,,,,,,,
Cj's Daiquiris,Cj's Daiquiris Baton Rouge,,https://cjs-daiquiris.wheree.com/,9618 Jefferson Hwy,,United States,US,,,Louisiana,LA,Baton Rouge,,,,70809,,,(225) 448-2188,"CJ's Daiquiris is a vibrant and welcoming destination, blending the charm of a local dive bar with an impressive selection of refreshing daiquiris.","CJ's Daiquiris stands out as a vibrant and welcoming destination, seamlessly blending the charm of a local dive bar with an impressive selection of refreshing daiquiris. Positioned conveniently in Baton Rouge, this establishment captures the essence of community spirit through its friendly atmosphere and attentive service. Guests are greeted by knowledgeable staff who not only serve great drinks but also engage patrons in delightful conversations that enhance their experience. The extensive menu features innovative flavors like the Pile Driver and Truth Serum daiquiris, ensuring there is something to satisfy every palate. Cleanliness remains a priority at CJ's Daiquiris, fostering an inviting environment for both casual visits or lively gatherings with friends. Patrons appreciate the accessible location that makes it easy to pop in for a quick drink or enjoy leisurely hours watching sports on television. Positive reviews consistently highlight how enjoyable it is to unwind at this locally run business during any occasionâbe it ladies' nights or casual outings. CJ's Daiquiris excels not only in beverage offerings but also shines through customer service, making each visit feel special and personalized. This commitment to quality ensures repeat visits from satisfied customers who cherish both exceptional drinks and great vibesâa true testament to what makes CJ's Daiquiris beloved within its neighborhood.",,,12/31/2050,Active,Silver,Nightlife->Bars->Sports Bars,,,,,New Listing Template,,,,,,,,,,,,,,,,
Cedar,Cedar Baton Rouge,cedar.cafe.hookah@gmail.com,https://www.facebook.com/cedarcafeandhookah/,1707 Gardere Ln,,United States,US,,,Louisiana,LA,Baton Rouge,,,,70820,,,(225) 256-5343,American cuisine with a Greek twist. A friendly and welcoming CafÃ© for all.,"American cuisine with a Greek twist. A friendly and welcoming CafÃ© for all. Locally owned and operated in Baton Rouge, Louisiana.",,,12/31/2050,Active,Silver,Food->Juice Bars & Smoothies,Restaurants->Cafes,Nightlife->Bars->Hookah Bars,,,New Listing Template,,,,,,,,,,,,,,,,
The Brakes Bar,The Brakes Bar Baton Rouge,,https://www.spokeandhubbr.com,5412 Government St,,United States,US,,,Louisiana,LA,Baton Rouge,,,,70806,,,(225) 529-3550,Bar located inside Spoke & Hub.,"Located within Spoke & Hub, The Brakes Bar offers a unique bar experience. Serving a variety of drinks.",,,12/31/2050,Active,Silver,Nightlife->Bars->Cocktail Bars,Arts & Entertainment->Music Venues,,,,New Listing Template,,,,,,,,,,,,,,,,
Walk-On's Sports Bistreaux - Juban Crossing Restaurant,Walk-On's Sports Bistreaux - Juban Crossing Restaurant Denham Springs,,https://walk-ons.com/,27010 Crossing Cir,,United States,US,,,Louisiana,LA,Denham Springs,,,,70726,,,(225) 243-7543,"Scratch-made dishes, wall-to-wall TVs, craft beers, and cocktails - For The Win.","Walk-On's Sports Bistreaux is a restaurant and sports bar. Scratch-made dishes, wall-to-wall TVs, craft beers, and cocktails - For The Win.",,,12/31/2050,Active,Silver,Restaurants->American,Nightlife->Bars->Sports Bars,Restaurants->Cajun/Creole,,,New Listing Template,,,,,,,,,,,,,,,,
Country Bar & Grill,Country Bar & Grill Denham Springs,CanktonCountryBar@yahoo.com,https://www.facebook.com/p/Cankton-Country-Bar-Hwy-93-100063535601907/,51662 Highway 16,,United States,US,,,Louisiana,LA,Denham Springs,,,,70706,,,(225) 667-7746,Pool & Billiard Hall,"VIDEO POKER / SPIRITS / BILLIARDS
APA LEAGUE & SLAPP HOST LOCATION
OPEN 8 BALL POOL TOURNAMENTS
WED",,,12/31/2050,Active,Silver,Nightlife->Bars->Sports Bars,,,,,New Listing Template,,,,,,,,,,,,,,,,
Monjunis Italian Cafe,Monjunis Italian Cafe Baton Rouge,monjunisjimmy@gmail.com,https://monjunis.com/,711 Jefferson Hwy,,United States,US,,,Louisiana,LA,Baton Rouge,,,,70806,,,(225) 231-1595,Monjunis has a long great history. Itâs original store is located in a building constructed in the early 1920s. Back then it was called The Jay Hawk Cafe and served up âhonkey tonkâ good times.,"Monjunis has a long great history. Itâs original store is located in a building constructed in the early 1920s. Back then it was called The Jay Hawk Cafe and served up âhonkey tonkâ good times. Bring the Italian flavours to your Home. Share it in a Family ambience, relax and enjoy.",,,12/31/2050,Active,Silver,Restaurants->Italian,Restaurants->Seafood,Nightlife->Bars->Cocktail Bars,,,New Listing Template,,,,,,,,,,,,,,,,
Situla Ultra Lounge,Situla Ultra Lounge Baton Rouge,banks0616@yahoo.com,https://www.facebook.com/p/Situla-Ultra-Lounge-61552912379730/,2436 North St,,United States,US,,,Louisiana,LA,Baton Rouge,,,,70802,,,(225) 571-3290,"Bar and restaurant with R&B and Blues music, drinks, and daiquiris.",Situla Ultra Lounge is a spot for R&B and Blues music lovers! Sip on our delicious Drinks. They offer daiquiris and host events.,,,12/31/2050,Active,Silver,Nightlife->Bars,Arts & Entertainment->Music Venues,,,,New Listing Template,,,,,,,,,,,,,,,,
Corner Bar,Corner Bar Gonzales,,https://www.go-louisiana.com/Corner-Bar-Gonzales/,12260 Roddy Rd,,United States,US,,,Louisiana,LA,Gonzales,,,,70737,,,(225) 647-0234,"Corner Bar in Gonzales, Louisiana.","Corner Bar is located at 12260 Roddy Rd in Gonzales, Louisiana. They can be contacted via phone at 225-647-0234.",,,12/31/2050,Active,Silver,Nightlife,,,,,New Listing Template,,,,,,,,,,,,,,,,
J's Joint,J's Joint Plaquemine,,,58710 Belleview Rd,,United States,US,,,Louisiana,LA,Plaquemine,,,,70764,,,(225) 238-7696,,,,,12/31/2050,Active,Silver,Nightlife->Bars->Sports Bars,Restaurants->Burgers,Restaurants->Steakhouses,,,New Listing Template,,,,,,,,,,,,,,,,
Spanky's Daiquiries & Delites,Spanky's Daiquiries & Delites Baton Rouge,,http://www.spankysbr.com/,4621 S Sherwood Forest Blvd,,United States,US,,,Louisiana,LA,Baton Rouge,,,,70816,,,(225) 295-3314,Spanky's Daiquiris Sherwood is located in Baton Rouge. It is part of the Spanky's Daiquiris chain.,"Spanky's Daiquiris Sherwood is located at 4621 S Sherwood Forest Blvd, Baton Rouge, LA 70816. It is part of the Spanky's Daiquiris chain. Other locations are in Prairieville and Burbank. Must be 21 or older to enter.",,,12/31/2050,Active,Silver,Nightlife->Bars,,,,,New Listing Template,,,,,,,,,,,,,,,,
Joe Joe's Lounge,Joe Joe's Lounge Port Allen,,,3065 Rosedale Rd,,United States,US,,,Louisiana,LA,Port Allen,,,,70767,,,(225) 383-0674,,,,,12/31/2050,Active,Silver,Nightlife,,,,,New Listing Template,,,,,,,,,,,,,,,,
Mike Anderson's - Prairieville,Mike Anderson's - Prairieville Prairieville,prairieville@mikeandersons.com,https://mikeandersons.com/locations-prairieville/,16400 Airline Hwy,,United States,US,,,Louisiana,LA,Prairieville,,,,70769,,,(225) 677-6453,"The Prairieville location of Mike Anderson's Seafood restaurant offers a perfect location for food and fun with friends and family. Established in 1975, Mike Anderson's journey of greatness continues with you. All American, All Louisiana, All YOU!","Mike Andersonâs Seafood was established in 1975. Mike was a newcomer, a rookie, to the restaurant business â But as both a legendary college football great and a retired athlete, he knew that success came with hard work and determination. Formerly an All-American Linebacker at LSU, Mike was literally not afraid to tackle anything, including the restaurant business. Today, over forty years later, the journey of greatness continues with you.

All American, All Louisiana, All YOU!",,,12/31/2050,Active,Silver,Restaurants->Southern,Restaurants->Seafood,Nightlife->Bars->Cocktail Bars,,,New Listing Template,,,,,,,,,,,,,,,,
Da Truf Eel Entertainment,Da Truf Eel Entertainment Baton Rouge,,https://da-truf-eel-entertainment-inc.square.site/,11154 Susan Ave,,United States,US,,,Louisiana,LA,Baton Rouge,,,,70815,,,(225) 888-9842,Art comes alive at our signature events or classes. See what's coming up soon.,Join the club and get all the inside info into the business side of the music industry!,,,12/31/2050,Active,Silver,Arts & Entertainment->Music Venues,Local Services->Recording & Rehearsal Studios,,,,New Listing Template,,,,,,,,,,,,,,,,
Club Castle,Club Castle Baton Rouge,,https://www.instagram.com/clubcastlelounge/,6763 Van Gogh Ave,,United States,US,,,Louisiana,LA,Baton Rouge,,,,70806,,,(225) 337-8105,Upscale Lounge â¢ Hookah â¢ Drinks â¢ Food,"Upscale Lounge â¢ Hookah â¢ Drinks â¢ Food
ð 7425 Westheimer Rd
Houston, TX 77063
âï¸ For reservations, call or text
(832) 767-0503
ð¾Bottle service available
ð21+ to enter",,,12/31/2050,Active,Silver,Nightlife->Bars,,,,,New Listing Template,,,,,,,,,,,,,,,,
Taqueria Solis,Taqueria Solis Baton Rouge,,https://www.facebook.com/p/Taqueria-Solis-100089574324684/,11904 Coursey Blvd,,United States,US,,,Louisiana,LA,Baton Rouge,,,,70816,,,,"Digital creator. Lives in Baton Rouge, Louisiana",Estamos en pulga de gonzales y 11484 florida blvd,,,12/31/2050,Active,Silver,Restaurants->Mexican,Nightlife->Bars->Sports Bars,,,,New Listing Template,,,,,,,,,,,,,,,,
Henry Turner Jr's Listening Room,Henry Turner Jr's Listening Room Baton Rouge,,https://www.henryslisteningroom.com,2733 North St,,United States,US,,,Louisiana,LA,Baton Rouge,,,,70802,,,(225) 802-9681,The domain isn't connected to a website yet. Instructions are provided on how to connect it to a Wix website.,"The page displays an error message indicating that the domain is not connected to a website yet. It provides instructions on how to connect the domain to a Wix website, including navigating to Wix.com, accessing the Subscriptions > Domains section, and following the steps to connect the domain. It also provides a link to the Wix Support Team for additional help.",,,12/31/2050,Active,Silver,Arts & Entertainment->Music Venues,Event Planning & Services->Venues & Event Spaces,,,,New Listing Template,,,,,,,,,,,,,,,,
