Listing Title,Listing Email,Listing URL,Listing Address,Listing Short Description,Listing Long Description
Duvic's,contact@duvicsbar.com,https://duvicsbar.com/,2854 Kalurah St,"Duvic's is located at 2854 Kalurah St. Baton Rouge, LA 70808. They can be contacted by phone at +1 (225) 336-4821 or by email at contact@duvicsbar.com.","There are many variations of passages of Lorem Ipsum available, but the majority have suffered alteration in some form, by injected humour, or randomised words which don't look even slightly believable. If you are going to use a passage of Lorem Ipsum, you need to be sure there isn't anything embarrassing hidden in the middle of text. Duvic's offers drinks such as Signature Martinis, Cocktails and Beer. Food options include Lunch, Dinner, Desert and Sunday Brunch."
Zee Zee's,zeezeesbar@gmail.com,https://www.zeezeesbr.com/,2943 Perkins Rd,Bar & Grill in LA,"Zee Zees is a bar and grill located at 2943 Perkins Road, Baton Rouge, LA 70808. They are closed on Mondays. Tuesday - Thursday: 4:00 pm - 2:00 am, Friday - Saturday: 11:00 am - 2:00 am, Sunday: 11:00 am - 12:00 am."
Tallulah Crafted Food & Wine Bar,Tallulah@renaissancebatonrouge.com,https://tallulahrestaurant.com/,7000 Bluebonnet Blvd,"Tallulah is a casual upscale restaurant that serves breakfast, lunch, and dinner. It includes a wine bar and a large outdoor terrace, offering guests a selection of fine wines, specialty cocktails, and local brews. Live music is available on Wednesday, Thursday, and Friday nights during happy hour.","Tallulah presents a reimagining with fresh new menus in a familiar, yet captivating environment. The restaurant serves breakfast, lunch and dinner and includes a wine bar & refreshed, large outdoor terrace, offering guests the perfect location to enjoy an extensive selection of fine wines by the glass, specialty cocktails and local brews on tap. Live music is back on Wednesday, Thursday & Friday nights along with exciting happy hour offerings."
The Lighthouse Bar & Pizzeria,N/A,https://www.instagram.com/the_lighthousebar/,8416 Scotland Ave,The Light House Bar & Pizzeria,N/A
King Bar & Bistro,N/A,https://www.kingbarandbistro.com/,200 Convention St,King Bar & Bistro is located inside the historic Hotel Indigo Baton Rouge Downtown.,Located inside the historic Hotel Indigo Baton Rouge Downtown. N/A
Rockstar Singing Telegrams,jeff@rockstarsingingtelegrams.com,https://www.rockstarsingingtelegrams.com/,,Provides performers for birthdays and special events. They deliver a show that includes a seasoned pro musician and a rose or chocolate and a balloon.,Rockstar Singing Telegrams provides performers for birthdays and special events. They deliver a show that includes a seasoned pro musician and a rose or chocolate and a balloon.
Chow Yum,michael@chowyumbr.com,https://www.chowyumbr.com/,2363 Hollydale Ave,"Chow Yum is an Asian Fusion restaurant in Baton Rouge, LA, offering down-to-earth street food.","Chow Yum aims to embody the spirit of street food, which is a way of life for billions of people around the world. It's a means of livelihood, sustenance, socialization, and economic contribution. Street food transcends social classes and is a fundamental part of a culture's culinary heritage, with recipes passed down through generations and meant to be enjoyed by all. Chow Yum stands for this inclusive and accessible food experience."
The Parlor,N/A,https://www.yelp.com/biz/the-parlor-baton-rouge,705 Saint Joseph St,"Hair salon offering haircuts in Baton Rouge, LA.","The Parlor is a hair salon located at 11616 Southfork Ave, Ste 300, Baton Rouge, LA 70816. It offers services such as haircuts. The salon is open Tuesday through Friday and closed on Sundays and Saturdays. They are By Appointment Only, Wheelchair accessible and Accepts Credit Cards and Android Pay."
Nooley's,nooleyspville@gmail.com,https://nooleys.com/,17134 LA-44,"Nooley's Poboys, Wings, and Curly Cues. Restaurant in Prairieville.","Nooley's Poboys, Wings & Curley Cues Your home for great sandwiches, and awesome wings! We do catering too!

Follow us on Instagram and Twitter @eatnooleys"
Kenny‚Äôs Cue Club & Tavern,N/A,https://www.facebook.com/kennyscueclub/,10627 Alco Ave,Kenny's Cue Club is Baton Rouge's premier non-smoking pool hall.,"Kenny's Cue Club is Baton Rouge's premier non-smoking pool hall complete with beautiful bartenders, craft cocktails, Golden Tee and more!"
Spanky's Daiquiris,N/A,http://www.spankysdaiquiris.com,17316 Airline Hwy,Spanky's Daiquiris Prairieville: The best Daiquiris on the planet!,Founded in 1988 in Baton Rouge. Prairieville location was opened in the fall of 2002. Spanky's has thrived on providing smooth rich and powerful daiquiris
City Cafe,citycafe113@bellsouth.net,https://citycafebr.net/,4710 O'Neal Ln,"City Cafe is a family restaurant in Baton Rouge, LA, serving classic American comfort food in a cozy and friendly atmosphere since 2002. The restaurant has a long history dating back to 1919, with original family recipes.","City Cafe has been providing good food and good service at modest prices since being established by Martin Miranda in 1919. In 1933, Martin‚Äôs brother Jimmy Miranda, wife Marie, and sister-in-law Louise began management of the restaurant, which continued for the following 43 years.

Located on Main Street in Plaquemine, next to the railroad depot where men waited for the next train, City Cafe has seen its share of history. As the men waited on their way to World War II and the Korean War, many meals were provided by Jimmy at no cost to the soldiers. In the 1930's and 1940's, City Cafe was more than a place to get good food. The downtown area of Plaquemine was a hotbed of activity. Slot machines, horse races, and poker tables provided entertainment for the patrons after a good meal.

In 1976, Jimmy and Marine sold the restaurant and it was ""out of the family"" for four years. Charles ""Squeaky"" Miranda, Jimmy and Marine's son was a Plaquemine student-athlete who went on to become a teacher and coach. While coaching at Broadmoor High School, he met Stephanie Bourgeois, a teacher at the school, and they were married. It was in 1980 that Charles decided to go back to his roots and buy back the restaurant.

His mother Marie and Aunt Louise came back to the Cafe when Charles re-opened it in 1981 after an extensive remodeling. The restaurant again became a mainstay for the locals, as well as the nearby plant workers, for breakfast, lunch, and dinner. In 1994, a fire left the restaurant in disarray, but a menu from the ""golden age"" survived. Sandwiches 25 cents, hamburger steak 60 cents, breakfast (two eggs and a homemade biscuit) 30 cents, beer 19 cents. After rebuilding, Charles, mother Marie, and Aunt Louise continued on until the Plaquemine restaurant was sold in 1998.

GRAND Re-Opening in Baton Rouge!
Charles decided to re-open City Cafe in Baton Rouge in 2002. Today, the tradition of modest prices, friendly service, and good food continues. Some of the dishes date back to the original family recipes of 1919.

We hope you enjoy the family atmosphere and tradition of City Cafe - the place ""Where Good Friends Meet."""
Cypress Coast Brewing,N/A,https://www.instagram.com/cypresscoastbrewing/,5643 Government St,"Craft brewery in Monterey, CA. Tasting Room is open 7 days a week!",N/A
River Rouge Kitchen & Bar,N/A,N/A,5500 Hilton Ave,N/A,N/A
Fat Tuesday,N/A,https://www.malloflouisiana.com/en/directory/11653/,6401 Bluebonnet Blvd,Fat Tuesday units generally have fun food items to complement the featured frozen specialty drinks.,"The Fat Tuesday concept has grown into an international phenomenon with over 20 retail units throughout the United States, Mexico, Puerto Rico and Honduras in cities such as Miami, Key West, Las Vegas, Cozumel, San Juan and Roatan."
Pink Agave,pinkagavebatonrouge@gmail.com,https://www.pinkagavetaqueria.com,4001 Nicholson Dr,Contact form for customers to send messages.,"The page provides a contact form for customers to reach out. It also lists the locations with addresses, phone numbers, and email addresses for Ponchatoula, Covington, Amite, and Baton Rouge."
TAP 65,info@tap65.com,https://www.tap65.com/,515 Mouton St,"TAP 65 brings 65 rotating beers, wines, and bourbons to the heart of Government Street. Located in the old White Star Market building, Tap 65 reimagines classic Indian cuisine and pairs it with the perfect beverages. Featuring a self-pour tap wall and a full bar dedicated to craft cocktails, memories are bound to be made.","The newest craft expansion from Rick and Needhi Patel, Tap 65 brings 65 rotating beers, wines, and bourbons to the heart of Government Street. Located in the old White Star Market building, Tap 65 reimagines classic Indian cuisine and pairs it with the perfect beverages. Featuring a self-pour tap wall and a full bar dedicated to craft cocktails, memories are bound to be made."
Landry‚Äôs 190 Connection,admin@225liveevents.com,https://www.225liveevents.com/index.php/venue/detail/Landry's-190-Connection/98,1822 Plantation Ave,Live Music / Karaoke,Landry's 190 Connection is a venue that hosts live music and karaoke events. The venue is located at 1822 Plantation Ave in Port Allen. They have a facebook page located at https://www.facebook.com/Sugar-Patch-Lounge-101111756607794/.
cocktails and cigar Bar,N/A,https://www.stogies-lounge.com/,30780 La Highway 16,"Stogies is a laid back lounge, where you can enjoy a daiquiri, cocktail, cigar or pipe. We have a drive through window so you can get your daiquiris on the go.","Stogies is a laid back lounge where you can enjoy a daiquiri, cocktail, cigar, or pipe. They offer a drive-through window for daiquiris on the go and a wide selection of cigars, pipes, aromatic pipe tobaccos, and accessories. The staff is friendly and knowledgeable, providing a relaxing atmosphere to unwind."
Capital Park Bar and Grill,capitalparkbr@gmail.com,https://www.instagram.com/capitalparkbr/?hl=en,7132 Florida Blvd,"Capital Park Bar and Grill in Baton Rouge, LA, offers brunch, outdoor patio, Sunday brunch parties, and day parties. Free entry, bottomless mimosas, food, drink specials, and great vibes.","Capital Park Bar & Grill is located at 7132 Florida Boulevard, Baton Rouge, LA. They offer brunch, outdoor patio, Sunday brunch parties, and day parties. Free entry, bottomless mimosas, food, drink specials, hookahs, great music, and even better vibes."
The Smiling Dog,N/A,https://smilingdogbr.com/,4215 South Sherwood Forest Blvd,Pub dishes and local brews.,"The Smiling Dog is a pub located at 4215 South Sherwood Forest Boulevard in Baton Rouge, Louisiana. They offer pub dishes and local brews. Kitchen closes at 10 PM every night. Lunch is served M-F from 11 AM - 2 PM. Brunch is served on Sundays from 10 AM - 2 PM."
Blackie's Place,N/A,https://www.facebook.com/blackiesplacecentral/,10010 Sullivan Rd,Small bar with live music and entertainment.,"Blackie's Place is a small bar located at 10010 Sullivan Rd, Baton Rouge, LA. It is known as a ""hole in the wall"" that provides a variety of entertainment. They have live music, karaoke, and other events. "
Chimes Restaurant,N/A,https://thechimes.com/,3357 Highland Rd,The Chimes Restaurant & Tap Room has been a Baton Rouge and LSU tradition serving fine patrons for over 25 years.,"The Chimes Restaurant & Tap Room has been a Baton Rouge and LSU tradition serving fine patrons for over 25 years. We have continued to grow and have brought this tradition to our second location in Baton Rouge, a third location in Covington, and now a fourth, located in Lafayette. Our goal is to provide a relaxed, family friendly experience while serving the best made-from-scratch menu possible. We take pride in having one of the most extensive beer and liquor selections available. Thank you for your continued support, we look forward to seeing you soon!"
Rickochet Billards,tinag@rickochets.com,https://www.rickochets.com/,17540 Airline Hwy,"Rickochet's Prairieville is a Bar and Billiards Hall with (6) 7 ft. Diamond Smart tables & (4) 8 ft. Brunswick tables. We also carry arcade darts, golf, and bowling! Fun, Friendly Atmosphere! We are a Non smoking establishment and proper dress is required.",Rickochet's Prairieville is a bar and billiards hall offering a fun and friendly atmosphere with various games and the best bar food in town. They host leagues and tournaments and have happy hour drink specials. Must be 21+ to enter.
Deuce‚Äôs Bar and Lounge,N/A,N/A,3575 N Acadian Thruway,N/A,N/A
Comedy Plus Network,N/A,N/A,,N/A,N/A
The Kingfish Grill,info@kingfishgrill.com,https://www.kingfishgrill.com/,201 Lafayette St,"The Best Fresh Fish on the Water! Located minutes from downtown St. Augustine, Florida.","Kingfish Grill was established in June 2005 by owner Paul Mackey. Originally from coastal New England, the restaurateur has a passion for seafood, using his background & upbringing to contribute to the flare and spice at Kingfish Grill. The team at Kingfish Grill have made it a favorite restaurant among locals and visitors alike. We invite you to come share our excitement of great food, great service & spirits!"
X Bio Discotec,Osman78@hotmail.com,https://www.facebook.com/XBIODISCOTEC/,11690 Florida Blvd,Haciendo la diferencia Baton Rouge,N/A
City Pork Perkins,N/A,https://www.citypork.com/,18143 Perkins Rd E,"Unmistakingly ""Louisianan"" elevated cuisine & award-winning bbq gulf seafood. Offering Weekday Breakfast , & Lunch , Dinner & Weekend Brunch.","It all started with City Pork Deli back in the day and has grown into 2 restaurants with a full service catering department. Still serving amazing sandwiches, City Pork has added to the menu to include southern favors for everyone. City Pork and City Group Hospitality believe in sourcing locally and celebrating the flavors which make Baton Rouge culinary scene special. City Pork house smokes our meats and you can taste the time and love put into it!"
Cheba Hut Toasted Subs,batonrouge-benhur@chebahut.com,https://www.facebook.com/ChebaHutBatonRouge/,411 Ben Hur Rd,"Cheba Hut is a ""toasted"" sub sandwich shop with a full bar.","Cheba Hut is a ""toasted"" sub sandwich shop with a full bar. We pride ourselves in providing a laid back vibe and some of the best sub sandwiches you have ever experienced."
Locals Bar and Kitchen,N/A,N/A,7755 Magnolia Beach Rd,N/A,N/A
Mom's Place,N/A,https://www.facebook.com/UncleBuddys?__tn__=-UC*F,42028 Highway 42,Mom's Place lunch special for February 12,"Goodmorning! This is what we will have on our lunch specials today, if you‚Äôd like to make a Togo order you can call 580-798-6473. Have a great day!!"
MonteCristo Cigar Bar & Bistro,MonteCristo.br.events@gmail.com,https://www.facebook.com/p/MonteCristo-Cigar-Bar-Bistro-BR-100083071845204/,7808 Howell Blvd,Cigar Bar/Lounge & Bistro,"MonteCristo Cigar Bar & Bistro - BR is a cigar bar and bistro located in Baton Rouge, LA. They host various events, including crawfish & chill nights, after-parties, and themed mixers. They offer drink specials and have a mature and sophisticated atmosphere."
Urban Daiquiris,URBANDAIQUIRIS@GMAIL.COM,https://urbandaiquiris.com/,17497 Airline Hwy,"Urban Daiquiris is opening a new location in Prairieville, Louisiana.","Urban Daiquiris is opening a new location in Prairieville, Louisiana. The grand opening is August 4th & 5th. They are actively interviewing for bar experienced workers."
Tsunami Sushi Highland BR,tsunami.highlandbr@servingsushi.com,https://highland.servingsushi.com/baton-rouge-tsunami-highland-br-about,1 Smart Wy,"Tsunami Sushi‚Äôs second Baton Rouge location, located at the corner of Highland Rd and Bluebonnet Blvd. The menu focuses on fresh seafood and diverse Asian dishes, blending Japanese and Eastern flavors with Southern roots.","Tsunami Sushi‚Äôs second Baton Rouge location, Tsunami Highland (2024), is located at the corner of Highland Rd and Bluebonnet Blvd. It aims to expand the culinary legacy of Tsunami while maintaining the brand. The menu focuses on fresh seafood and diverse Asian dishes, blending Japanese and Eastern flavors with Southern roots. The menu offers standard sushi rolls, nigiri and sashimi, and grilled fish, chicken, and pork."
Mom‚Äôs Bar,cjsbyjosh@gmail.com,https://www.facebook.com/momsbarprairieville/,42028  HWY 42,"Great neighborhood bar with karaoke , pet friendly",N/A
Bayou Billards,bayoubilliards@yahoo.com,https://www.facebook.com/bayoubilliards,10090 Florida Blvd,We're just an old Billiards hall who will treat you like family and maybe even set up a game for you,N/A
Chocolate City Sports Bar And Lounge,N/A,https://www.facebook.com/p/Chocolate-City-Sports-Bar-Lounge-llc-100083297322613/,4961 Gus Young Ave,"Sports bar and lounge in Baton Rouge, LA.","Chocolate City Sports Bar & Lounge llc. in Baton Rouge, LA. It is categorized as a bar."
Jolie Pearl Oyster Bar,N/A,https://joliepearloysterbar.modihost.com/,315 N Blvd,"Jolie Pearl Oyster Bar is a restaurant in Baton Rouge, Louisiana.","The page provides contact information for Jolie Pearl Oyster Bar, including their address (315 North Boulevard, Baton Rouge, LA 70801), phone number (225-615-7172), summer hours, and links to their social media profiles. It also mentions that they offer lunch/dinner, cocktails/beer/wine, catering, and private event options. The page encourages visitors to reach out for more information about the restaurant, specific events, or job opportunities."
Tiger Sports Bar,N/A,https://www.facebook.com/TigerSportsBar/,826 O'neal Ln,"Tiger Sports Bar is Baton Rouge‚Äôs neighborhood bar with 14 HD TVs, 4 Diamond Pool Tables, etc‚Ä¶","Tiger Sports Bar is Baton Rouge‚Äôs neighborhood bar with 14 HD TVs, 4 Diamond Pool Tables, etc‚Ä¶"
Palermo Ristorante,N/A,http://palermobr.com/,7809 Jefferson Hwy A,"A delightful blend of classic and Modern.Authentic.Italian. ‚Äì right in the heart of Baton Rouge, near Towne Center/Bocage. Intimate dining, exceptional service, handcrafted cocktails, and genuine Italian wines.","Discover a delightful blend of classic and Modern.Authentic.Italian. ‚Äì right in the heart of Baton Rouge, near Towne Center/Bocage. Stop in and enjoy our exquisite Italian fare, prepared √† la minute (prepared to order) featuring a light, tasteful menu. We boast intimate dining, exceptional service, handcrafted cocktails, and genuine Italian wines. Full-service bar and outside patio dining. Reservations are recommended. WAITR Delivery is available."
Playboy's Lounge,N/A,N/A,4011 Mulatto Bend Rd,N/A,N/A
Spoke & Hub,N/A,N/A,5412 Government St,N/A,N/A
Firehaus - Baton Rouge,N/A,https://www.firehausbr.com/,1700 Government St,"A cashless wine bar, indoor/outdoor lounge, and rooftop oasis in Baton Rouge.","Welcome to Firehaus, Baton Rouge's fiery hotspot for wine enthusiasts and social butterflies. As a cashless wine bar, indoor/outdoor lounge, and rooftop oasis, we're igniting the scene with our fiery ambiance and curated selection of fine wines. Join us for an unforgettable experience where flames of flavor and sparks of excitement collide."
Baby 4,N/A,https://www.instagram.com/lalo/,,Photographer | Director Based in NYC Represented by @bransch_nyc,N/A
ESPN BET Sportsbook,lbr.guestexperience@pngaming.com,https://www.lbatonrouge.com/casino/sportsbook/,777 L'auberge Ave,"ESPN BET‚Ä¶ Baton Rouge's home for sports! Bet on and watch your favorite teams on our big screens. Plus, grab a burger and an ice-cold pint. Get ready to bring your crew for all the game-day action!","ESPN BET at L'Auberge Casino Hotel Baton Rouge is the premier destination for sports enthusiasts in Baton Rouge. It offers a comprehensive sports betting experience with big screens for viewing games, a variety of betting options, and a dining area serving burgers and drinks. Over 20 Sports Betting Kiosks Available 24/7!"
Suthern Kumfort's Gentleman's Club,N/A,N/A,17807 Airline Hwy,N/A,N/A
New Orleans Original Daiquiris,N/A,https://nolaoriginal.com/,13375 Hwy 73,The original (and best) New Orleans FROZEN DAIQUIRIS since 1983. A friendly and welcoming spot where our neighbors could stop by to grab a frozen drink and kick back.,"We started out in 1983. Our goal was to offer a friendly and welcoming spot where our neighbors could stop by to grab a frozen drink and kick back. Little did we know we were paving the way for a frozen drink trend that would shape a category and become part of Louisiana local culture. David Briggs Jr. was the mastermind behind this phenomenon‚Äîpassing out samples on Bourbon Street, and innovating the craft with a chilling machine that made our frozen daiquiris instantly available. We brought the Big Freezy to the Big Easy, dat is. Through the 80s and 90s, we opened up new spots around the New Orleans metropolitan area and expanded to the suburbs and Baton Rouge. You‚Äôre sure to find a NOLA Original down the road or around your neighborhood. When Hurricane Katrina hit us all pretty bad back in 2005, we quickly reopened our stores to help kickstart the city's economy. It turns out New Orleans isn‚Äôt the only place that appreciates a good drink. From a few chilling machines, we‚Äôre now close to 50 locations across Louisiana."
Cj's Daiquiris,N/A,https://cjs-daiquiris.wheree.com/,9618 Jefferson Hwy,"CJ's Daiquiris is a vibrant and welcoming destination, blending the charm of a local dive bar with an impressive selection of refreshing daiquiris.","CJ's Daiquiris stands out as a vibrant and welcoming destination, seamlessly blending the charm of a local dive bar with an impressive selection of refreshing daiquiris. Positioned conveniently in Baton Rouge, this establishment captures the essence of community spirit through its friendly atmosphere and attentive service. Guests are greeted by knowledgeable staff who not only serve great drinks but also engage patrons in delightful conversations that enhance their experience. The extensive menu features innovative flavors like the Pile Driver and Truth Serum daiquiris, ensuring there is something to satisfy every palate. Cleanliness remains a priority at CJ's Daiquiris, fostering an inviting environment for both casual visits or lively gatherings with friends. Patrons appreciate the accessible location that makes it easy to pop in for a quick drink or enjoy leisurely hours watching sports on television. Positive reviews consistently highlight how enjoyable it is to unwind at this locally run business during any occasion‚Äîbe it ladies' nights or casual outings. CJ's Daiquiris excels not only in beverage offerings but also shines through customer service, making each visit feel special and personalized. This commitment to quality ensures repeat visits from satisfied customers who cherish both exceptional drinks and great vibes‚Äîa true testament to what makes CJ's Daiquiris beloved within its neighborhood."
Cedar,cedar.cafe.hookah@gmail.com,https://www.facebook.com/cedarcafeandhookah/,1707 Gardere Ln,American cuisine with a Greek twist. A friendly and welcoming Caf√© for all.,"American cuisine with a Greek twist. A friendly and welcoming Caf√© for all. Locally owned and operated in Baton Rouge, Louisiana."
The Brakes Bar,N/A,https://www.spokeandhubbr.com,5412 Government St,Bar located inside Spoke & Hub.,"Located within Spoke & Hub, The Brakes Bar offers a unique bar experience. Serving a variety of drinks."
Walk-On's Sports Bistreaux - Juban Crossing Restaurant,N/A,https://walk-ons.com/,27010 Crossing Cir,"Scratch-made dishes, wall-to-wall TVs, craft beers, and cocktails - For The Win.","Walk-On's Sports Bistreaux is a restaurant and sports bar. Scratch-made dishes, wall-to-wall TVs, craft beers, and cocktails - For The Win."
Country Bar & Grill,CanktonCountryBar@yahoo.com,https://www.facebook.com/p/Cankton-Country-Bar-Hwy-93-100063535601907/,51662 Highway 16,Pool & Billiard Hall,"VIDEO POKER / SPIRITS / BILLIARDS
APA LEAGUE & SLAPP HOST LOCATION
OPEN 8 BALL POOL TOURNAMENTS
WED"
Monjunis Italian Cafe,monjunisjimmy@gmail.com,https://monjunis.com/,711 Jefferson Hwy,Monjunis has a long great history. It‚Äôs original store is located in a building constructed in the early 1920s. Back then it was called The Jay Hawk Cafe and served up ‚Äúhonkey tonk‚Äù good times.,"Monjunis has a long great history. It‚Äôs original store is located in a building constructed in the early 1920s. Back then it was called The Jay Hawk Cafe and served up ‚Äúhonkey tonk‚Äù good times. Bring the Italian flavours to your Home. Share it in a Family ambience, relax and enjoy."
Situla Ultra Lounge,banks0616@yahoo.com,https://www.facebook.com/p/Situla-Ultra-Lounge-61552912379730/,2436 North St,"Bar and restaurant with R&B and Blues music, drinks, and daiquiris.",Situla Ultra Lounge is a spot for R&B and Blues music lovers! Sip on our delicious Drinks. They offer daiquiris and host events.
Corner Bar,N/A,https://www.go-louisiana.com/Corner-Bar-Gonzales/,12260 Roddy Rd,"Corner Bar in Gonzales, Louisiana.","Corner Bar is located at 12260 Roddy Rd in Gonzales, Louisiana. They can be contacted via phone at 225-647-0234."
J's Joint,N/A,N/A,58710 Belleview Rd,N/A,N/A
Spanky's Daiquiries & Delites,N/A,http://www.spankysbr.com/,4621 S Sherwood Forest Blvd,Spanky's Daiquiris Sherwood is located in Baton Rouge. It is part of the Spanky's Daiquiris chain.,"Spanky's Daiquiris Sherwood is located at 4621 S Sherwood Forest Blvd, Baton Rouge, LA 70816. It is part of the Spanky's Daiquiris chain. Other locations are in Prairieville and Burbank. Must be 21 or older to enter."
Joe Joe's Lounge,N/A,N/A,3065 Rosedale Rd,N/A,N/A
