Listing Title,Listing Email,Listing URL,Listing Address,Listing Short Description,Listing Long Description
Pass√©,N/A,https://www.passebatonrouge.com/,101 St Ferdinand St,Celebrates the magic of French-inspired Creole cuisine.,"At Pass√©, we celebrate the magic of French-inspired Creole cuisine. Our menu is a vibrant mosaic of flavors, colors, and tastes, crafted with care using the finest local ingredients. Where days start with a locally brewed coffee and end with a carefully crafted cocktail, our all-day menu will be sure to bring the spirit of Louisiana in every dish."
Varsity Theatre,N/A,https://varsitytheatre.com/,3353 Highland Rd,"Originally operated as a film theatre, The Varsity Theatre has been a staple in Baton Rouge since the 1930s. Reopened as Baton Rouge‚Äôs premiere live music venue in 1990 playing host to both local and nationally touring artists.","The Varsity first opened its doors in 1937, filling a variety of roles in the film-theatre industry until it‚Äôs closure in 1988. We reopened as Baton Rouge‚Äôs premiere live music venue in 1990 playing host to both local and nationally touring artists.

The Varsity is also an ideal space to host your next social, private, or corporate event. The Varsity Theatre is an ideal venue for weddings and receptions, birthday, cocktail, and graduation parties, award ceremonies and more. Our stage is sized and equipped to accommodate both local and touring acts, DJ's, or presenters with our professional sound and light rig and available projection screens. We can help fulfill your catering needs with food from the The Chimes or coordinate with an outside caterer of your choosing."
Bin 77 Bistro & SideBar,info@bin77.com,https://bin77.com/,10111 Perkins Rd,"Bin 77 is a bistro and sidebar offering wines from around the world, great food, and a comfortable, inviting atmosphere. They also host live music and offer catering and private party options.","Bin 77 Bistro & Sidebar is regularly described by customers as inviting, relaxing, and experiential. They encourage wine tasting and sharing wine knowledge. They offer wines from around the world, great food, live music, catering, and private parties."
The Beer Vault,thebeervaultds@gmail.com,https://www.facebook.com/TheBeerVault/,23610 LA Hwy 16,"Local neighborhood sports bar. Friendly atmosphere, cold beer, shot specials, and no drama. Come enjoy an after work beer and say hello.",N/A
George's Place,georgesplace@bellsouth.net,https://batonrouge.gaycities.com/2794-georges-place,860 Saint Louis St,"A friendly gay bar in Baton Rouge with karaoke, male dancers, and drag shows.","George's Place is a gay bar in Baton Rouge, Louisiana. It is known for its friendly staff, fair drink prices, karaoke, male dancers, and drag shows."
Big Dog Saloon,N/A,https://big-dog-saloon.wsite.top/,7857 Florida Blvd,Sports bar with friendly bartenders and a relaxing atmosphere.,"Big Dog Saloon is a sports bar located in Livingston Parish, Louisiana. It offers outdoor parking, a parking lot, and a casual ambiance. Customers have praised the friendly bartenders, great drinks, and relaxing atmosphere."
Red Stick Social,info.redsticksocial@gmail.com,https://redsticksocial.com/,1503 Government St,"Located inSide Mid City'S Electric Depot,
Red Stick Social iS the capital city'S premier entertainment venue.","WHAT IS RED STICK SOCIAL?
SOCIAL HOUSE
Baton Rougeís newest live music venue in an intimate setting.Need to grab a coffee and catch up with friends? Laid back spot for a small meeting? Finish that pitch deck or term paper? Red Stick is the spot for you to stay connected with WiFi throughout.
LIVE MUSIC
Baton Rougeís live music venue in an intimate setting.
FOOD & BEVERAGE
Locally inspired small plates with both indoor and covered outdoor seating, a pet-friendly beer garden, and rooftop patio. Breakfast, lunch, dinner, late night grub, Sunday brunch.
PRIVATE/GROUP EVENTS
Birthday parties, anniversaries, baby showers, holiday parties, special occasions or corporate events, let us tailor an unforgettable experience for groups of any size.
For private event inquiries please click here.
BOWLING
Featuring ten state of the art Brunswick lanes including four lanes in the VIP/private event area.
COMMUNITY EVENTS & IMPACT
We believe in supporting our local community and being activeÖfrom hosting events to supporting local charitiesÖ.we give back to those who support us."
Beer Bellys,N/A,N/A,57945 Main St,N/A,N/A
225 Crab Seafood & Bar,N/A,225crabbr.com,5252 S Sherwood Forest Blvd,A seafood restaurant.,225 Crab Juicy Seafood and Bar is a Tex-Mex restaurant opening a seafood spot at 5252 S Sherwood Forest Plaza.
End-Zone Daiquiri & Bar,N/A,https://www.instagram.com/accounts/login/?next=%2Ftheendzonedaiquiribr%2F&source=omni_redirect,6224 Plank Rd,N/A,N/A
Bengal Tap Room,N/A,N/A,421 3rd St,N/A,N/A
Rocca Pizzeria,social@roccapizzeria.com,https://www.roccapizzeria.com/,3897 Government St,Rocca Pizzeria is a restaurant.,Rocca Pizzeria is a restaurant.
Side Porch Daiquiris Bar,b@sideporchbar.com,https://sideporchbar.com/,6641 La Highway 1 S,"Side Porch Daiquiris is a bar offering daiquiris in Addis, Louisiana.","Side Porch Daiquiris is a bar located at 6641 Louisiana Highway 1, Addis, Louisiana. They offer a variety of daiquiris and have contact information available on their website."
Pizza Art Wine,info@pizzaartwine.com,https://www.pizzaartwine.com/,7673 Perkins Rd C1,"Pizza Art Wine offers pizza, art, and wine in Baton Rouge. They also host live music and events.",Pizza Art Wine offers a unique dining experience with a focus on art and wine. They have a variety of pizzas and also offer live music and events.
Squeaky Pete's,dustin@squeakypetesbr.com,https://www.squeakypetesbr.com/,326 3rd St,Downtown Baton Rouge's #1 & Only Country Bar and Dance Hall,Downtown Baton Rouge's 1st and only country bar! Catch us honky tonkin' and grab a cold one!
Prince Smoke Shop,N/A,https://www.instagram.com/princesmokeand/,9600 Florida Blvd,Prince Smoke and Vape,"The Instagram page for Prince Smoke and Vape. The page has 17 posts, 174 followers, and is following 4 accounts."
Churchill's,N/A,http://churchillsbr.com/,2561 Citiplace Ct,"A unique establishment in the heart of Baton Rouge. Buy a cigar, a bottle of wine or spirit in the retail area. Grab a...","A unique establishment in the heart of Baton Rouge. Buy a cigar, a bottle of wine or spirit in the retail area. Grab a..."
Drew & Willie's Sports Bar,N/A,N/A,6865 Magnolia Beach Rd,N/A,N/A
Solera Bar & Tasting Room,info@solerabr.com,https://solerabr.com/,4205 Perkins Rd,Restaurant and Wine Bar,The bar at Solera is the perfect place to meet and take in Baton Rouge‚Äôs most unique atmosphere. Order one of our custom cocktails or enjoy one of our amazing wines.
Brickyard South,broge15@gmail.com,http://www.brickyardsouth.com/,174 S Blvd,"Baton Rouge Louisiana's unofficial official dive bar catering to local artists, musicians, service industry heroes, the Baton Rouge Zydeco hockey team and nice people who still like to have a few drinks, hang out and get weird.","Baton Rouge Louisiana's unofficial official dive bar catering to local artists, musicians, service industry heroes, the Baton Rouge Zydeco hockey team and nice people who still like to have a few drinks, hang out and get weird. Voted #1 Bar of All Time."
The Bookstore,thebookstorebar@gmail.com,https://www.facebook.com/TheBookstoreBar/about_contact_and_basic_info,10466 Airline Hwy,The Bookstore is a bar.,The Bookstore is a bar.
Club Coozan,N/A,https://rockitbandla.com/locations/club-coozan/,10920 Mead Rd,A live music venue in Baton Rouge associated with Rock-It band.,"Club Coozan is a venue located at 10929 Mead Road, Baton Rouge, Louisiana. It is associated with Rock-It band."
Club Secret,info@barandclub.com,https://www.barandclub.com/united-states/louisiana/plaquemine/venues/club-secret,23090 W St,N/A,"Bar And Club is a nightlife marketing company transforming the way you discover the best spots to drink and party. By partnering with your favorite venues, we keep you informed and updated on happy hour specials and nightlife events in your area."
Frankie‚Äôs Dawg House,N/A,N/A,6166 Siegen Ln,N/A,N/A
Clicks Billiards,N/A,https://www.clicks.com/,5124 Corporate Blvd,"CLICKS Billiards - Billiards, Games, Sports, Bar & Grill","At Clicks Billiards, our mission is to provide an entertaining space where friends and family can gather to enjoy great food, engage in friendly competition, and create lasting memories. Established in multiple vibrant locations, we take pride in offering a unique experience that combines delicious American fare with the excitement of billiards."
Coconut Willy‚Äôs Daiquiris,N/A,https://www.facebook.com/coconutwillys/,35055 Hwy 16,"Visit any of our locations in Watson, Zachary, Central, Southside Denham Springs, and French Settlement","Visit any of our locations in Watson, Zachary, Central, Southside Denham Springs, and French Settlement. Hours vary by location."
Tiger Paw Daiquiris-LSU,N/A,https://www.instagram.com/tigerpawlsubenhur/,5635 Nicholson Dr,LSU's newest drive thru daiquiri shop.,LSU's newest drive thru daiquiri shop. Open 7 days a week.
Agave Blue Tequila & Taco Bar,N/A,https://www.agavebluela.com/,17097 Airline Hwy,"Mexican restaurant and tequila bar serving fresh, authentic food and handmade margaritas.","Agave Blue opened in Prairieville, LA on November 27, 2015, and it is run by husband and wife duo Stephanie and Sergio Rubio. Being partners in other restaurants, we also wanted to open our own concept so that we could be 100% ourselves, from our food down to the d√©cor. We have put our heart and soul into this entire place, which we consider a family restaurant because you will often see our children around or helping us out as well. We want parents to feel comfortable coming here with their families as well, as they will be welcomed by our family. In addition to our fresh authentic food, we also love the bar area that Stephanie runs. All of our margaritas are hand made with fresh ingredients, with the exception of our frozen and citrus on the rocks. We hand squeeze our lemon and lime juice, use fresh fruits, and use a high quality tequila el Jimador in all of our margaritas. We pride ourselves on the freshness of our drinks and our food. Sergio is very hands on and runs our kitchen. He also painstakingly chose each and every item for the menu making sure to be as authentic and fresh as possible. Being from Queretaro, Mexico, he has a great eye for flavor and a passion for food. We plan on adding special tacos from time to time, so be on the look out for our new ideas! We hope that everyone that comes here enjoys their visit and comes back again and again. Agave Blue is the Mexican Restaurant that has it all, and we think you will fall in love with Prairieville's best Taco & Tequila bar!"
Our Mom's,N/A,https://www.ourmomsrestaurant.com/,250 W Lee Dr,"Our Mom's Restaurant and Bar is the ideal place to grab family dinner and unwind after work. With rotating taps, handcrafted cocktails, and killer happy hour specials every night of the week, Our Mom's is perfect for your next celebration. Serving up burgers, salads, and everything in-between, Our Mom's offers a little dose of home in every bite.","With locations in Hammond and Baton Rouge, Our Mom's Restaurant and Bar is the ideal place to grab family dinner and unwind after work. With rotating taps, handcrafted cocktails, and killer happy hour specials every night of the week, Our Mom's is perfect for your next celebration. Serving up burgers, salads, and everything in-between,  Our Mom's offers a little dose of home in every bite. So come, relax, and have a drink with us...and remember... Nobody does it better than Our Mom's."
Dancers,dancersmensclub@ymail.com,https://www.instagram.com/dancersmensclub/,5755 Airline Hwy,Urban Gentlemen's club in Baton Rouge.,"#1 Urban Gentlemen's club. Located at 5755 Airline Hwy Baton Rouge, LA. Must be 21+ years of age."
Skeeters'lounge,swampdarts@skeeterslounge.com,http://skeeterslounge.com,10763 Old Hammond Hwy,Bar/Lounge in Baton Rouge. Possibly closed.,"Skeeters Lounge is located at 10763 Old Hammond Hwy Baton Rouge, LA. It appears to be a bar/lounge. It may be permanently closed."
Swamp Shack Daiquiris,N/A,https://swampshackdaiquiris.com/,812 Lobdell Hwy,"Swamp Shack offers a variety of daiquiri flavors, over ice and gallon drinks, singles, 6-packs, 12-packs, and cases of premium domestic beer, non-alcoholic daiquiris, smoothies and so much more!","Swamp Shack Daiquiris in Port Allen, LA, offers 18 original daiquiri flavors, gallon-sized mixed drinks like Cajun Bloody Mary and Swamp Water Iced Tea, and 11 non-alcoholic daiquiris and smoothies. They promise one liter of liquor per gallon with great flavor. The establishment aims to provide a Swamp Feel and Cajun Atmosphere."
The Station Sports Bar and Grill,info@thestationbr.com,https://thestationbr.com/,4608 Bennington Ave,"The Station in Baton Rouge, Louisiana is a must-visit spot for locals and visitors, offering the best beer, sports, and burgers around. With over 100 beers and multiple big screens showing local sports, our sports bar, located inside actual train cars, offers a unique and fun atmosphere with one of the largest sports memorabilia collections in South Louisiana.","The Station in Baton Rouge, Louisiana is a must-visit spot for locals and visitors. It offers a unique atmosphere with a sports bar located inside actual train cars, featuring over 100 beers, multiple big screens for sports, and one of the largest sports memorabilia collections in South Louisiana. They host live music on Thursdays, karaoke Thursday-Saturday, and Open Mic Comedy on Wednesdays. It's a great spot for LSU game days with free touchdown shots and private room rentals. They also offer bar catering services."
Eliza Restaurant & Bar,hello@elizabatonrouge.com,http://elizabatonrouge.com/,7970 Jefferson Hwy,"Scratch kitchen focused on using local, seasonal products.","We are a scratch kitchen focused on using local, seasonal products. As such, our menu changes often and there may be limited availability with certain dishes. Please consult the most current menu before visiting. Thank you."
Keilas Bar & Lounge,N/A,https://www.facebook.com/p/Keilas-Bar-and-Lounge-100054617162758/,1533 N Acadian Thruway W,Total Adult Atmosphere,"This Facebook page promotes Keila's Bar and Lounge, highlighting daily specials, events like Tacos & Tequila Tuesdays, Early Happy Hour, Blue Mondays, and themed parties. The bar is located at 5035 Plank Rd, Baton Rouge, LA."
Old New Orleans Bar & Grill,N/A,N/A,648 Lobdell Ave,N/A,N/A
Premier Sound Services of Louisiana,N/A,https://pssdj.com/,3348 Drusilla Ln,"Professional DJ Entertainment in Baton Rouge, LA offering Wedding Reception, Ceremony Systems, Photobooths, Monogram and Uplighting.","PSSDJ offers DJs for any occasion, including weddings, corporate events, galas, fashion shows, fundraisers, and family/company picnics. They provide great music with custom playlists and online planning tools. They also offer photobooths, decorative uplights and monogram projection."
The Lost Cove,Derek@DiversifiedServicesLLC.com,thelostcove.com,5625 Essen Ln,The Lost Cove is a full hook up RV park on Smith Lake. We offer boat slip rental and storage as well.,The Lost Cove is a full hook up RV park on Smith Lake. They offer boat slip rental and storage.
MID TAP,N/A,N/A,660 Arlington Creek Centre Blvd,N/A,N/A
Chengs Restaurant & Bar,N/A,https://chengsrestaurant.net/,7951 One Calais Ave,"Cheng's Restaurant & Bar offers authentic Chinese food in Baton Rouge, with fresh, cook-to-order dishes.","Cheng's Restaurant and Bar is located at 7951 One Calais Ave #3403, Baton Rouge, LA 70809. They specialize in Hunan & Sichuan cuisine made with locally sourced and quality ingredients. They have over 300 5-star reviews on Google and Yelp and offer over 100 authentic Chinese menu items."
Big Mike's Sports Bar & Grill,bigmikesds123@gmail.com,https://bigmikessportsbarandgrill.com/,123 Aspen Sq,"Known for tasty burgers, signature sandwiches, steaks, catfish, and shrimp.","Big Mike‚Äôs is located near l-12 just off Range in the bustling heart of Denham Springs. Stop in for lunch or dinner, or just to enjoy a drink with friends."
Bald Eagle Pub,baldeaglepma@baldeaglepub.com,https://www.facebook.com/BaldEaglePub/,140 Main St,"Best Happy Hour in Town, Great Nightly Specials. Politically Themed Pub. A Local Favorite with a Loc","Best Happy Hour in Town, Great Nightly Specials. Politically Themed Pub. A Local Favorite with a Loc"
Stogies Cocktail & Cigar Lounge,N/A,https://www.stogies-lounge.com/,30614 La Hwy16,"Cocktails, Cigars & Daiquiris. Stogies is a laid back lounge, where you can enjoy a daiquiri, cocktail, cigar or pipe. We have a drive through window so you can get your daiquiris on the go.","Stogies is a laid back lounge, where you can enjoy a daiquiri, cocktail, cigar or pipe. We have a drive through window so you can get your daiquiris on the go.

We know life gets busy. Our lounge is a relaxing place to take a load off. We have a huge selection of cigars and pipes, aromatic pipe tobaccos and pipe accessories.

Our friendly staff is here to serve you."
The Gregory,info@thegregorybr.com,https://www.thegregorybr.com/,150 Third St,Gourmet Dining in Downtown Baton Rouge. The Gregory at Watermark hotel is Baton Rouge‚Äôs choice for a modern spin on classic Louisiana soul food.,"The Gregory at Watermark hotel is Baton Rouge‚Äôs choice for a modern spin on classic Louisiana soul food. Our chefs create one-of-a-kind dishes influenced by Southern cooking styles. To enjoy dining in our upscale atmosphere, reserve a table or book a private event today!

Unlike Any Other

What sets the best restaurants in Baton Rouge apart from the rest? In some cases, it is a well-established chef, ambiance, or other factors. In almost all cases, however, the best restaurants in downtown Baton Rouge have one thing in common ‚Äî exceptional food.

Our culinary team designs The Gregory‚Äôs menus around the flavors of Baton Rouge, Louisiana. We utilize fresh, local produce and organic ingredients that offer inspired twists on classic dishes and drinks."
Green Rabbit Tavern,N/A,https://greenrabbittavern.com/,4612 Bennington Ave,"Baton Rouge's Okayest Bar with Beer, Pool Tables, and Privare Karaoke Rooms","At Green Rabbit Tavern, we pride ourselves on offering a unique atmosphere where friends gather, and memories are made. Our friendly staff is dedicated to providing excellent service, making you feel right at home. Whether you're here for a casual night out or a special celebration, Green Rabbit Tavern is the perfect destination. With pool tables, dart boards, fooseball, private karaoke rooms, and great drinks, The Green Rabbit is the best dive bar in Baton Rouge."
The House In Tigerland,N/A,https://www.yelp.com/biz/the-house-in-tigerland-baton-rouge,1003 Bob Petit Blvd,"The House In Tigerland is a sports bar located in Baton Rouge, LA. It has a ""fresh"" inviting vibe. The owners are taking pride in their bar. It is clean and well taken care of. The house is also one of the few bars in tiger land that now serves food. The pizza was incredible! Tiger land has a reputation as a college bar area, but the house succeeded in keeping that atmosphere with a little bit of sophistication. Highly recommend this bar for all.","This place is like no other. In addition to great drink specials and fast and friendly customer service, The House also offers 0.50$ wing nights on Tuesdays. These are not to be missed. They offer 5 different sauce options and have recently added cheese fries and mozzarella sticks... both tasty and delicious. If you're looking for a good time be sure to Take It to The House."
Blend,scott@blendbr.com,https://www.blendbr.com/,304 Laurel St,"Blend Wine Bar offers wines, tastes and remedies.","Blend Wine Bar is located in Baton Rouge, LA. It offers wines, tastes and remedies."
Paint Remix,sales@paintremixllc.com,https://www.facebook.com/paintremix/,9131 Cortana Pl,"Paint meets music in a fun, creative environment.","Where paint meets music remixed with a smile, fun-filled creativity, diversity rocking New Orleans Style"
Cedarcrest Bar,N/A,http://www.cedarcrestbarbyprovo.com/,10467 Airline Hwy,Welcome to the home of diversity! We give you the experience of an eclectic and comfortable environment.,N/A
IceHouse Tap Room,N/A,https://icehouse-tap-room.wheree.com/,14111 Airline Hwy,"IceHouse Tap Room is a vibrant neighborhood bar in Baton Rouge known for delicious food, refreshing drinks, and a lively atmosphere, featuring live music and community events.","Nestled in the heart of Baton Rouge, IceHouse Tap Room stands out as a vibrant neighborhood bar that perfectly combines delicious food, refreshing drinks, and an inviting atmosphere. Known for its exceptional boudin sausage tacos and a menu that transcends typical bar fare, this lively establishment serves up flavors that are consistently praised for their quality and taste. With an appealing outdoor space that welcomes everyone, IceHouse Tap Room is designed for fun and relaxation. The venue often features live music that enhances the lively ambiance, making it an ideal spot for gathering with friends or enjoying a laid-back evening. The friendly and attentive staff elevate the experience, ensuring that every visit feels like a special occasion. From engaging bar games to exciting community events, including football watch parties and crawfish boils, IceHouse Tap Room captures the essence of camaraderie and local charm. This is more than just a bar; it's a gathering place where great food, cold beers, and entertainment come"
Don Juan Cigar Company,N/A,http://Www.donjuancigarbar.com/,7539 Corporate Blvd,"Don Juan Cigar Company is a cigar bar in Baton Rouge, LA.","Don Juan Cigar Company is a bar located at 7539 Corporate Blvd Suite 160, Baton Rouge, LA, United States, 70809. They can be contacted by phone at (225) 960-7597. Their website is http://Www.donjuancigarbar.com/."
Second Story,N/A,https://www.instagram.com/secondstorybar/,214 3rd St,No dress code cocktail lounge with balcony and hookah located downtown above @violet.nightclub.br in BR.,"Second Story at 214 is a cocktail bar with no dress code, featuring a balcony and hookah, located downtown above Violet Nightclub in Baton Rouge."
Roberto's River Road Restaurant,robertos1985hwy75@gmail.com,http://robertosrestaurant.net/,1985 Hwy 75,Serving some of the freshest Cajun & Creole dishes that South LA has to offer -- all made with love in our nearly 200-year-old building in the heart of Cajun Country.,"Roberto's River Road Restaurant offers fresh Cajun & Creole dishes in a nearly 200-year-old building in Sunshine, LA. They are open Tuesday - Friday: 11:00 AM - 2:00 PM, 5:00 PM - 9:00 PM and Saturday: 5:00 PM - 9:00 PM. They are closed on Mondays and Sundays."
Blue Corn Tequila & Tacos,admin@bluecornrestaurant.com,https://bluecornrestaurant.com/,7673 Perkins Rd,"A different kind of Mexican Restaurant serving the Baton Rouge LA area, a modern industrial concept with a traditional respect for the food using the same process from back home with fresh ingredients to create an experience you will enjoy.","A different kind of Mexican Restaurant serving the Baton Rouge LA area, a modern industrial concept with a traditional respect for the food using the same process from back home with fresh ingredients to create an experience you will enjoy.

Awonderful interpretation of Traditional Mexican Dishes with fresh ingredients. We stay true to the process to provide classics from our homeland. A beautifully designed bar stocked with a wide variety of tequila, mescal, and assorted fruit for handcrafted cocktails.

Acontemporary design with Industrial lighting and an outside patio make this a great place to enjoy food and drinks with friends and family. The walls as well as the menu have art inspired by El Dia de Los Muertos."
BRQ Seafood and Barbeque,info@brqrestaurant.com,https://www.brqrestaurant.com/,10423 Jefferson Hwy,"BRQ Seafood & Barbeque is a restaurant in Baton Rouge offering BBQ, seafood, and catering services.","BRQ Seafood & Barbeque offers menus for Main, Lunch, Brunch, Easter Brunch, Weekly Specials, Kids, and Lenten Specials. They also have Bar and Catering services along with options for Revelry Tailgating, Tailgating Packages, Weddings/Bacon & Fig Events, and Value Packs. Reservations can be made for the restaurant, Event Rental, and Private Dining Experience. The restaurant also offers gift cards and newsletter."
Phil Brady's Bar & Grill,N/A,https://phil-bradys-bar-grill.wheree.com/,4848 Government St,"Phil Brady's Bar & Grill is a dive bar in East Baton Rouge Parish, Louisiana, known for live music, pool tables, and homemade burgers on Mondays.","Welcome to Phil Brady's Bar & Grill, a hidden gem in the heart of Baton Rouge that captivates with its warm, inviting atmosphere and vibrant local music scene. Esteemed for its reliable live entertainment, this beloved neighborhood spot boasts an array of talented musicians gracing the stage, making each visit a unique auditory experience. Guests can unwind with a cold beer while enjoying friendly service from attentive bartenders, transforming any night into a memorable outing. The bar is noted for its homemade burgers, served exclusively on Monday nights, earning accolades as the best burger in town. With pool tables and a lively dive ambiance, Phil Brady's is perfect for both casual gatherings and special events. This smoke-free venue thrives on community spirit and showcases a rotating lineup of local artists, ensuring entertainment is always at the forefront. Experience the heart and soul of Baton Rouge at Phil Brady's Bar & Grill, where every night feels like a celebration."
