Listing Title,Listing Email,Listing URL,Listing Address,Listing Short Description,Listing Long Description
The Penthouse Club - Baton Rouge,info@penthousebatonrouge.com,https://batonrouge.penthouseclub.com/,4622 Bennington Ave,"Baton Rouge‚Äôs Elite Night Club Experience. The Penthouse Club offers a luxurious experience with themed events, a full bar, VIP rooms, and topless cabaret.","Welcome to The Penthouse Club! You‚Äôre here because you seek excitement, adventure, and, above all else, an escape. No other night club in Baton Rouge can act as a portal into your most lavish fantasies. Visit the Penthouse Club and you‚Äôre sure to have a truly luxurious experience ‚Äî one you won‚Äôt soon forget.

Our gentlemen‚Äôs club thrives on themed events. We frequently host a variety of exclusive affairs centered on such themes as Burlesque, naked sushi, surrealist art, and more. Take advantage of these events to commemorate a celebration on any scale ‚Äî from taking on a new account, closing a major sale, or hosting your best friend‚Äôs bachelor or bachelorette party.

Enhance any evening with our full bar, diverse champagne list, VIP rooms, executive suites, topless cabaret, and other amenities. Don‚Äôt settle for generic strip clubs or night clubs. Baton Rouge men and women know The Penthouse Club is the preferred location for a truly enjoyable experience. Browse our site to learn more about our upcoming events, our Penthouse Pets, our services, and more. Make reservations or visit us today."
Illusions Gentlemen's Club,N/A,https://www.facebook.com/StripClubKingWoodvilleMs/,1500 US Hwy 61 S,Nude Strip Club $10.00 Admission BYOB.,N/A
The Gold Club,N/A,https://goldclubgonzales.com/,37034 E Hwy 30,Experience the Gold Standard,N/A
Candy's Mens Club,candysmensclubla@gmail.com,candysmensclub.com,41969 Hwy 16,Adult entertainment nightclub and bar.,"Candy's Mens Club is an adult entertainment venue offering nightclub and bar services, including liquor, beer, strippers, draft beer, cabaret, exotic dancers, and entertainers."
Crazy Horse Cabaret,N/A,http://www.crazyhorseportallen.com,2901 I-10 Frontage Rd,"Crazy Horse Cabaret in Port Allen, LA, features food & drinks, photos, bottle service, career opportunities, and location & hours information. They offer free lunch, happy hour, and a dining menu.","Crazy Horse Cabaret in Port Allen offers free lunch Monday-Friday from 11:30am-2:30pm with daily specials like Chicken Fried Steak, Jambalaya, and Spaghetti & Meatballs. Happy Hour is Monday-Friday from 3:00pm - 7:00pm with specials on domestic beers, well cocktails, specialty beers, and wine. The dining menu includes appetizers, sides, entrees, and specials available all day & night. They also offer bottle service, and are always looking for new talent. Contact them to submit an application."
Cash Magic/Silver Fox Casino,mhenry@bhwk.com,https://www.cashmagiccasino.com/,40249 La Hwy 16,"Cash Magic Truck Plaza & Casino owns convenient locations throughout the beautiful state of Louisiana. They offer casinos featuring popular video poker games and brands, convenience stores, fueling stations and dine-in restaurants.","Cash Magic Truck Plaza & Casino owns convenient locations throughout the beautiful state of Louisiana. We currently operate in ten parishes: Caddo, Calcasieu, Jefferson, Lafourche, St. Helena, St. Landry, St. Martin, St. Mary, Terrebonne, and Webster. All of our locations are open 24 hours a day, 365 days a year, offering casinos featuring popular video poker games and brands, convenience stores, fueling stations and dine-in restaurants. At Cash Magic we are committed to providing a fun, exciting and safe gaming experience by offering exceptional service at a great value. We pride ourselves on being F.A.S.T.: Friendliness, Accountability, Service Excellence, Teamwork. Cash Magic Casinos operate over 1,100 video poker gaming devices within our locations across the state. We pride ourselves on being good corporate neighbors and proudly employ over 700 Louisiana residents."
The Ace of Clubs,N/A,https://www.facebook.com/1999AceOfClubs,1999 Bayou Rd,N/A,N/A
fun parties,N/A,https://www.yelp.com/biz/fun-parties-thibodaux,1122 Hwy 20,Adult Entertainment,N/A
Slumber Parties,claudia@slumberparties.com,http://www.slumberpartiesinc.com,4224 Evan Brooks Dr,N/A,N/A
The Cedar Saloon,thecedarsaloon@gmail.com,https://www.thecedarsaloon.com/,7171 Morganza Hwy,"A fun and lively night out spot in Morganza, LA.","The Cedar Saloon is now available to rent as an EVENT VENUE! It is located at 7171 Morganza Hwy, Morganza, LA 70759."
Juban's,N/A,https://www.jubans.com/,3739 Perkins Rd,"Est. 1983, Jubans' distinctive flavor and unforgettable atmosphere make every dining occasion a deli",N/A
The Sportsbook at L'Auberge Baton Rouge,N/A,https://www.lbatonrouge.com/casino/sportsbook/,777 L'auberge Ave,"ESPN BET is Baton Rouge's home for sports betting, featuring big screens, a restaurant, and a wide variety of sports to bet on.","ESPN BET in Baton Rouge offers a comprehensive sports betting experience with big screens to watch games, a restaurant, and numerous sports betting kiosks available 24/7. The venue provides a place to bet on and watch your favorite teams, enjoy food and drinks, and experience the game-day action with friends. The ESPN BET app offers exclusive odds boosts and custom offers for online wagering."
Thai Kitchen,thaikitchenbrla@gmail.com,https://www.thaikitchenla.com/,4550 Concord Ave,"Authentic Thai flavors since 1989, offering a variety of Thai and Dim-Sum dishes.","Family-owned and operated, Thai Kitchen has been a Baton Rouge staple for authentic Thai flavors since 1989. Our extensive menu offers a variety of Thai, Dim-Sum, daily drink specials, and a great happy hour! Food is prepared fresh, and herbs are grown in-house for a fresh and organic bite in every dish. Our inviting space is perfect for an intimate evening or large groups alike, with extensive indoor and outdoor seating, plus live music, and an inviting sports bar. Voted Best Thai Restaurant by 225 & Dig Magazine."
L A Daiquiris,N/A,https://www.facebook.com/people/La-Daiquiris/100066774621654/?sk=about,1962 Oneal Ln,La Daiquiris is a Bar.,N/A
Tip Off Sports Bar & Grill,N/A,N/A,2972 Florida Blvd,N/A,N/A
Zea Rotisserie & Bar,N/A,https://zearestaurants.com/location/denham-springs/,27186 Crossing Cir,"Zea Rotisserie & Bar - Denham Springs. We‚Äôre fired up about sharing amazing flavors with our delicious rotisserie, Handcrafted cocktails, and an experience like no other.","We‚Äôre fired up about sharing amazing flavors with our delicious rotisserie, Handcrafted cocktails, and an experience like no other."
Daiquiri Cafe,N/A,N/A,2742 S Sherwood Forest Blvd,N/A,N/A
Applebee's Grill + Bar,N/A,https://restaurants.applebees.com/en-us/locations/la/baton-rouge/9702-airline-highway/4048,9702 Airline Hwy,"Casual dining restaurant offering American cuisine in Baton Rouge, LA.","Applebee's Neighborhood Grill + Bar is a full-service restaurant chain offering a varied menu of American cuisine. This location at 9702 Airline Hwy in Baton Rouge, LA, provides a casual dining experience with a focus on grill items, appetizers, and beverages. While specific details may vary, Applebee's generally aims to provide a welcoming atmosphere for families and individuals alike. The restaurant also offers online ordering and delivery services."
Zorba's Greek Bistro,opa@zorbasbistro.com,https://www.zorbasbistro.com/,5713 Essen Ln,"Zorba's Greek Bistro is located at 5713 Essen Lane, Suite B, Baton Rouge, LA 70810. Reservations are recommended due to limited seating. Contact number: (225) 444-5074. Catering orders must be placed at least 24 hours in advance of pickup time.","Zorba's Greek Bistro is located in Baton Rouge, LA. The bistro's hours are Tuesday - Thursday 11am - 2pm & 5pm ‚Äì 8:30pm, Friday 11am - 2pm & 5pm ‚Äì 9:30pm, Saturday 5pm ‚Äì 9:30pm, and Sunday & Monday Closed. For catering & private party inquiries, contact opa@zorbasbistro.com. Catering orders must be placed at least 24 hours in advance of pickup time. For reservations, please call 225-444-5074."
Shooters Lounge,N/A,N/A,22405  Hwy 1,N/A,N/A
Buffalo Wild Wings,bwwbatonrouge@brcoxmail.com,https://www.buffalowildwings.com,7524 Blue Bonnet Blvd,Sports bar chain serving wings & other American fare amid TVs broadcasting sporting events.,"Buffalo Wild Wings is a restaurant and sports bar. The menu includes wings, burgers, sandwiches, salads, and appetizers. The restaurant also has a full bar with a wide selection of beers, wines, and cocktails. Buffalo Wild Wings is a popular place to watch sporting events, and the restaurant typically has a large crowd during games."
The Cottage Inn,N/A,https://www.facebook.com/p/The-Cottage-Inn-100077894899044/,14214 Hwy 73,Coldest beer in town and the prettiest smiles around !,N/A
Lorraine's Pub & Grub,lorrainespub@gmail.com,https://www.facebook.com/p/Lorraines-Pub-and-Grub-100089587041987/,8837 Florida Blvd,YOUR NEW FAVORITE SPOT üíú,N/A
"Double ""D"" Daiquiris",N/A,https://double-d-daiquiris.wheree.com/,32334 La Hwy 16,"Double D Daiquiris stands out as a vibrant and inviting establishment, renowned for its exceptional selection of daiquiris and lively atmosphere.","Located in Denham Springs, this unique destination boasts an extensive array of flavors that cater to every palate‚Äîfrom classic favorites to innovative concoctions like the beloved Eggnog daiquiri. The visually appealing space features comfortable seating arrangements, eye-catching black lights, and televisions for sports enthusiasts, creating a dynamic environment perfect for unwinding with friends or enjoying live music nights. Customers appreciate the professional yet friendly service provided by well-trained bartenders who ensure each drink is crafted to perfection. With both indoor seating and a convenient drive-thru option available, guests can easily choose how they wish to indulge in their favorite frozen treats without compromising on quality or experience. Notably, the establishment fosters a non-smoking ambiance that enhances enjoyment while offering entertainment options such as karaoke nights and live bands. Double D Daiquiris has garnered attention not only for its great prices but also for the consistently welcoming vibe created by attentive staff members dedicated to enhancing customer satisfaction. This local gem exemplifies what it means to enjoy casual hangouts with ample choices in beverages‚Äîmaking it an essential stopover when seeking refreshing drinks paired with good times among friends."
Plush Bar & Grill,filler@godaddy.com,https://plushbarandgrill.com/,4250 Burbank Dr,Plush Bar & Grill is your neighborhood haven offering all the essentials for great times!,"We are your neighborhood haven offering all the essentials for great times! Come enjoy daiquiris and mixed cocktails poured just right, fresh and high quality food featuring bar favorites with a twist, variety flavored hookahs, and entertainment to include live music and a house DJ playing all the hits to keep it all flowing. So no matter if you want to come in and enjoy a delicious and quick lunch, happy hour specials after work, weekend fun with adult vibes, or Sunday brunch with family we are the place for you! Come experience great vibes in a laid-back, comfortable, and stylish environment."
Hooters,N/A,https://www.hooters.com/locations/31506-siegen-lane/,6454 Siegen Ln,"Chicken Wings & Sports Bar in Baton Rouge, Louisiana.","Enjoy world famous wings and a great beer selection at Hooters of Siegen Lane. Eat-in or carryout, the best food in Louisiana can always be found right in Baton Rouge. Daily happy hour specials, drink specials and craft beer on tap."
Sporting News Grill,N/A,https://www.225batonrouge.com/article/sporting-news-grill/,4848 Constitution Ave,A sports bar inside Holiday Inn Select off College Drive with more than 30 HD flat screens. Offers a diverse menu for a hotel restaurant in a modern-d√©cor setting.,"Sporting News Grill is a sports bar located inside the Holiday Inn Select off College Drive. It features more than 30 HD flat screens and a staff who will cater to your menu choices and television programming picks. The grill offers a surprisingly diverse menu for a hotel restaurant, including sandwiches, steaks, seafood, a classic French Nicoise Salad, Jack Daniel‚Äôs Glazed Salmon, and 12-inch pizza pies."
Zippy's Burritos Tacos & More,N/A,https://www.zippysburritos.com/,3155 Perkins Rd,"Zippy's offers a variety of options for parties and catering, including room rentals, advance orders, and cocktail parties.","Zippy's offers room rentals, advance orders, and cocktail parties. Room rentals require a minimum of 50 people, and pricing can be obtained by calling. Advance orders require a minimum of 25 people and a $500 minimum order, plus tax and 18% gratuity, with tables saved with 48-hour notice for menu ordering. Cocktail parties also require a minimum of 25 people and a $500 minimum, plus tax and 18% gratuity, with tables saved with 48-hour notice for menu ordering. Cocktail party menu items include $11 quesadilla strips, $4.75 tacos, $3.50 flautas, $4.50 empanadas, and a $14.95 Zippy Dipper with salsa, guac, and queso. Contact Jerrica or Josh for more party information at 225-388-9000."
Palace,N/A,https://www.facebook.com/p/The-Palace-2300-100063654242996/,2310 Scenic Hwy,"The Palace 2300, Baton Rouge, Louisiana. Dance & Night Club.","The Palace 2300 is a dance and night club located in Baton Rouge, Louisiana. It has a Facebook page with 472 likes and 4810 check-ins. It is also listed on Instagram, Tripadvisor, X (formerly Twitter), Manta, and Around Airports. News articles indicate it was temporarily shut down in January 2021 for overcrowding concerns."
"TJ Ribs, Acadian",N/A,https://tjribs.com/,2324 S Acadian Thruway,Legendary Louisiana BBQ restaurant.,"TJ Ribs on Acadian Thruway is a Legendary Louisiana BBQ restaurant. They are a proud sponsor of LSU Sports. They offer catering, gift cards, and event space booking. "
Roy's Daiquiris,N/A,https://www.facebook.com/royal.daiquiris.5/,38501 Highway 42,Homemade fresh daiquiris everyday. Never a cover charge. Live bands and dj‚Äôs on weekends only!,Homemade fresh daiquiris everyday. Never a cover charge. Live bands and dj‚Äôs on weekends only!
TrickShots Sports Bar,N/A,https://trickshotssportsbar.com/,6865 Magnolia Beach Rd,Delicious Drinks and Friendly Atmosphere. Because Regular Shots are Boring!,"TrickShots Sports Bar is owned by Justin and Angela Winfree. It offers pool tables and tournaments for all skill levels, as well as league services. They have happy hour every weekday from 12pm-6pm! They also have Shuffleboard, Whiskey/Bourbon, and hold weekly events."
Walk-On‚Äôs Sports Bistreaux,N/A,https://walk-ons.com/,437 Oak Plaza Blvd,"Walk-On‚Äôs Sports Bistreaux is your home away from home. With our from-scratch dishes, wall-to-wall TVs and craft beer and cocktail lists, we make every occasion worth celebrating.","Walk-On‚Äôs Sports Bistreaux is your home away from home. With our from-scratch dishes, wall-to-wall TVs and craft beer and cocktail lists, we make every occasion worth celebrating. Our love for the game, community, and bringing the heart of a walk-on to the restaurant space began with the dreams of our Founder, Brandon Landry and his partner, Jack Warner, in 2003. We‚Äôve worked hard over the years to create a restaurant and bar concept that pairs attention-to-detail and culinary excellence with a little Louisiana spice, pulling in that underdog mindset and hospitality, making you feel like family the moment you walk in."
Ray's Bar,N/A,https://www.raysbar.com/,4715 Bennington Ave,Permanently closed pub & bar in Baton Rouge,"Triple A Bar is a permanently closed pub & bar in Baton Rouge. The price range per person is $25-$50. It is located at 4715 Bennington Ave, Baton Rouge, Louisiana, USA."
Gameday Daiquiris,Thekehlllc@icloud.com,https://m.facebook.com/cjsdaiquiris/,4525-4599 Bennington Ave,Daiquiri Shop and Neighborhood Sports Bar,"The Facebook page promotes CJ's Daiquiris, highlighting their daiquiris and sports bar atmosphere. A recent post advertises $5.50 mimosas all day."
Chili's,welcometochilis@chilis.com,https://www.chilis.com/locations/us/louisiana/baton-rouge/baton-rouge,4550 Constitution Ave,,
Jones Creek Cafe & Oyster Bar,info@jonescreekcafe.com,https://www.jonescreekcafe.com/,15005 Market St,"Jones Creek Cafe & Oyster Bar is located in Southeast Baton Rouge, LA, serving seafood dishes. They offer Louisiana's freshest oysters, Creole Gumbo, and Charbroiled Oysters.","Jones Creek Cafe & Oyster Bar is a Baton Rouge restaurant that has been serving the area for 35 years. It offers daily lunch specials, nightly dinner specials, and Sunday brunch. Diners can choose between the family-friendly Cafe, the Oyster Bar with TVs, or the outdoor patio with a fireplace. They also offer space to host events like group meetings, banquets, and special occasion dinners."
Pluckers,dbarrish@pluckers.net,https://www.pluckers.com/,4225 Nicholson Dr,"Pluckers Wing Bar location in College Station, TX.","Pluckers in College Station offers daily specials, including $1 wings on St. Paddy's Day, $1 off Pluckers Cocktails on Sundays, 5 free wings with the purchase of 10 on Mondays, All You Can Eat Wings on Mondays, Kids Eat Free on Tuesdays, Trivia on Wednesdays, Free Appetizer on Thursdays, and Teacher Freebie Friday."
Diamondz Sports Bar & Lounge,N/A,N/A,6046 Airline Hwy,Sports Bar,N/A
Walk-On's Sports Bistreaux - Burbank Restaurant,N/A,https://walk-ons.com/,3838 Burbank Dr,Sports bar and restaurant offering scratch-made dishes and a Louisiana-rooted family atmosphere.,"Walk-On‚Äôs Sports Bistreaux is your home away from home. Our restaurant and bar offer attention to detail and culinary excellence blended with service that pulls on our Louisiana roots, making you feel like family the moment you walk in. We pride ourselves in scratch-made dishes like fresh, never-frozen seafood, burgers, salads, some Cajun/Creole specialties to add a little spice and extensive beer taps and cocktail offerings. At Walk-On's, we treat every community like it's our homecourt - making friends and supporting our neighbors. Our love of the game means we're always fun, never forced, and our doors are open to anyone."
Uncle Moe's Food Mart & Deli,N/A,N/A,5557 Plank Rd,Quick bites such as cheeseburgers and po' boys.,Convenience store offering quick bites such as cheeseburgers and po' boys.
New Orleans Original Daiquiris,N/A,https://www.nolaoriginal.com/,1006 N Airline Hwy,New Orleans Original Daiquiris serves the original and best New Orleans frozen daiquiris since 1983.,"New Orleans Original Daiquiris offers a variety of frozen daiquiri flavors, available for dine-in or to-go. The company has multiple locations with drive-through options."
Jl's,N/A,https://www.instagram.com/jlsplacebr/,1115 Bob Pettit Blvd,A great place to watch some sports and have a drink.,"A great place to watch some sports and have a drink.
Geaux Tigers!

1115 Bob Petit Blvd, Baton Rouge, Louisiana"
Walk-On's Sports Bistreaux - Prairieville Restaurant,N/A,https://walk-ons.com/,14569 Airline Hwy,Sports bar and restaurant offering scratch-made dishes and a Louisiana-rooted family atmosphere.,"Walk-On‚Äôs Sports Bistreaux is your home away from home. Our restaurant and bar offer attention to detail and culinary excellence blended with service that pulls on our Louisiana roots, making you feel like family the moment you walk in. We pride ourselves in scratch-made dishes like fresh, never-frozen seafood, burgers, salads, some Cajun/Creole specialties to add a little spice and extensive beer taps and cocktail offerings. At Walk-On's, we treat every community like it's our homecourt - making friends and supporting our neighbors. Our love of the game means we're always fun, never forced, and our doors are open to anyone."
Coleman's Daiquiri & Liquor,N/A,https://www.facebook.com/pages/Coleman's%20Daiquiri/116411289801547/,1472 Harding Blvd,Coleman's Daiquiri is a sports bar.,"Coleman's Daiquiri is a sports bar located at 1472 Harding Blvd, Baton Rouge, LA 70807. It has a price range of $$. It was created on November 9, 2019. Recent posts mention karaoke nights and events related to Southern University Homecoming."
The Pit Sports Bar & Daiquiris,thepittoo@yahoo.com,http://www.thepittoo.com/,3495C Hwy 75,The Pit Sports Bar & daiquiris,"The Pit Too is a sports bar that offers pizza, beer, and wings."
Devics Bar Baton Rouge,contact@duvicsbar.com,https://duvicsbar.com/,2854 Kalurah St,"Lorem ipsum dolor sit amet, consectetur adipiscing elit. Proin diam justo, scelerisque non felis porta, placerat vestibulum nisi. Vestibulum ac elementum massa. In rutrum quis risus quis sollicitudin.","There are many variations of passages of Lorem Ipsum available, but the majority have suffered alteration in some form, by injected humour, or randomised words which don't look even slightly believable. If you are going to use a passage of Lorem Ipsum, you need to be sure there isn't anything embarrassing hidden in the middle of text."
Great American Grill,reservations@gagrill.com,https://gagrill.com/,3330 Harding Blvd,"Classic American cuisine, exceptional cocktails, and vibrant live entertainment.","Great American Grill in Hilmar, CA, offers a delightful blend of classic American cuisine, exceptional cocktails, and vibrant live entertainment in a charming venue perfect for any occasion."
On the Half Shell,N/A,https://www.onthehalfshell.biz/,37390 Perkins Rd,"Local seafood restaurant and live music hot spot for over 20 years. Serving fresh Louisiana seafood with a variety of other options to satisfy your tastebuds. All in a fun, family friendly atmosphere.","On The Half Shell, has been a local seafood restaurant and live music hot spot for over 20 years. Serving fresh Louisiana seafood with a variety of other options to satisfy your tastebuds. All in a fun, family friendly atmosphere.

Located conveniently in Prairieville,LA at the East Baton Rouge Parish line.

We offer daily lunch specials, a full lunch menu, dinner & Sunday brunch.

Live music is available  Tuesday - Saturday evenings & Sunday during brunch.

Visit our Live Music Calendar to see the full schedule.

Ask about special catering options for your next large group event in the Perkins Room.

Reservation and Catering information is available by calling 225-673-1951."
Hooters,N/A,https://www.hooters.com/locations/31509-denham-springs,254 Range 12 Blvd,"Chicken Wings & Sports Bar in Denham Springs, Louisiana","Enjoy world famous wings and a great beer selection at Hooters of Denham Springs. Eat-in or carryout, the best food in Louisiana can always be found right in Denham Springs. Daily happy hour specials, drink specials and craft beer on tap."
Chili's,welcometochilis@chilis.com,https://www.chilis.com/locations/us/louisiana/baton-rouge/millerville,1615 Millerville Rd,"Tex Mex, Bar & Grill, Family Restaurant","Chili's Grill & Bar in Millerville, LA is a Tex Mex style restaurant that offers Delivery. It has happy hour Monday to Friday: 3:00 PM - 6:00 PM and Saturday & Sunday: All Day. Happy hour includes discounts on Bud Light, Miller Lite, Coors Light, Modelo, Michelob Ultra and House Red & White Wine."
Buffalo Wild Wings,support@blazinrewards.com,https://www.buffalowildwings.com/en/locations/detail/0284,3260 Highland Road 2 & 3,N/A,N/A
Smack-a-Roos Sports Bar & Grill,N/A,https://www.mapquest.com/us/louisiana/smack-a-roos-sports-bar-grill-543346204,22930 hwy 1,Sports Bar & Grill,"Smack-a-Roos Sports Bar & Grill is a lively establishment in Plaquemine, LA, offering a casual dining experience with a focus on sports entertainment. Guests can enjoy a variety of pub-style food and drinks while watching their favorite teams compete on multiple screens throughout the venue."
Chili's,welcometochilis@chilis.com,https://www.chilis.com/locations/us/louisiana/denham-springs/denham-springs,135 Rushing Rd W,"Tex Mex, Bar & Grill, Family Restaurant","Chili's Grill & Bar in Rushing Rd, LA is a Tex Mex style restaurant that offers Delivery. It has happy hour Monday to Friday: 3:00 PM - 6:00 PM and Saturday & Sunday: All Day. Happy hour includes discounts on Bud Light, Miller Lite, Coors Light, Modelo, Michelob Ultra and House Red & White Wine."
Death Valley Daiquiri,deathvalleydaiquiris225@gmail.com,https://www.225liveevents.com/venue/detail/Death-Valley-Daiquiri/1554,5201 Nicholson Dr,"A spot to grab a drink, known for daiquiris.","Awesome little spot to grab a drink with coworkers after work! Chad the owner is the best and the prices are very reasonable. They have a wide selection of daiquiris, and they are all delicious!"
Grown Vibes Lounge & Grill,Grownvibesbr@gmail.com,http://www.grownvibes.com,1962 O'Neal Ln,"Grown Vibes Lounge is categorized as Karaoke, Entertainment Event, and Bar/pub.",N/A
City Slice Pizza & Pints,N/A,https://cityslicepizza.com/,124 W Chimes St,Contact information and booking for City Slice Pizza.,"The page provides a contact form for booking parties and lists the location, phone number, and hours of operation for City Slice Pizza at 124 West Chimes Street, Baton Rouge, LA 70802. The phone number is (225) 388-5454. Links to the menu and online ordering are also provided, as well as links to their Facebook, Instagram, and YouTube pages."
Luke Tant,N/A,N/A,3347 Highland Rd,N/A,N/A
