Listing Title,Listing Email,Listing URL,Listing Address,Listing Short Description,Listing Long Description
Gnarly Barley Brewing,info@gnarlybarley.com,https://gnarlybeer.com/,1709 Corbin Rd,Explore our journey from humble beginnings in a garage to becoming one of Louisiana's most celebrated craft breweries. Discover our passion for brewing and our commitment to quality.,"Our Journey from Garage to Brewery
Gnarly Barley Brewing Co. originated from the home of Zac and Cari Caramonta. What started in a cramped garage, surrounded by two fat cats and a halfpipe, quickly grew into a passion for crafting exceptional beers. Zac began homebrewing as an exploration into the brewing process after experiencing exceptional craft beers. His mission was to create beers just as excellent as those that inspired him. The Korova Milk Porter and the Hoppopotamus IPA debuted at the 2011 New Orleans on Tap Beer Festival. Encouraged by positive feedback and connections made at local festivals, Zac and Cari opened a 14,000 square foot brewery in Hammond, Louisiana in 2014.."
Low Road Brewing,N/A,https://www.lowroadbrewing.com/,1110 C M Fagan Dr,Low Road Brewing has ceased operations.,Low Road Brewing has ceased operations as of 12/31/2024. No further information is available.
Black Dog Cigar,ken@blkdogcigar.com,http://www.blkdogcigar.com/,842 West Main St,"Cigar shop with a walk-in humidor and full bar, sharing space with E & E Sports Bar.","In conjunction with the E&E Sports Bar, Full bar and courtyard. Open 10:00 Tues thru Sat. Covered open courtyard with big screen TVs. Walk-in Humidor, Full Bar. Located in New Iberia, LA. Shares space with E & E Sports Bar. Has a walk-in humidor and full bar. Offers premium cigar bundles and cigar related stuff. Has a covered open courtyard with big screen TVs."
Cigar Club,N/A,https://www.instagram.com/mo_cigarbar/,701 W Airline Hwy,"Members Only Cigar Bar in Laplace, Louisiana. Grown & Sexy Cigar Bar for drinks and Cigar Enthusiasts.","Members Only Cigar Bar (Laplace, La)
Grown & Sexy Cigar Bar for drinks and Cigar Enthusiasts
Open Weekdays 4PM - 11 PM"
Paradise Cigars and Tobacco,N/A,https://www.facebook.com/paradise.cigars.and.tobacco/,719 S Burnside Ave,N/A,N/A
Jack's Place,jillnbct@gmail.com,https://www.facebook.com/JacksPlace102/,102 S Jefferson Ave,Jack's Place is a Pool & Billiard Hall.,"Bingo every Wednesday @ Jack‚Äôs Place!!! Starts at 7:30PM, $5 Per Card or 5 for $20, 100% Payout"
Rockstar Singing Telegrams,jeff@rockstarsingingtelegrams.com,https://www.rockstarsingingtelegrams.com/,N/A,Rockstar Singing Telegrams is proven to make birthdays and special events ROCK!,"We know this is a ‚Äúonce in a lifetime‚Äù experience for them, that‚Äôs why we provide the best performers and deliver a show they will never forget. You get a seasoned pro musician who was born to deliver an unforgettable performance. Includes a rose or chocolate and a balloon!"
Baby 4,N/A,N/A,N/A,N/A,N/A
Red Stick Music,info@redstickmusic.com,https://www.redstickmusic.com/,N/A,Baton Rouge‚Äôs go-to source for live music events since 2014.,"Since 2014, Red Stick Music has been Baton Rouge‚Äôs go-to source for live music events. Our platform showcases the vibrant music scene in and around the city, offering a comprehensive calendar that helps both locals and visitors discover shows, festivals, and performances from all genres.
Red Stick Music is a trademark of FourLeafAudio LLC, owned by Christopher and Caitlen Odell, passionate audio engineers and avid live music enthusiasts. Driven by our love for live performances and dedication to the Baton Rouge community, we saw the need for a single, organized space where local music lovers could easily discover all the live events happening around them. 
Our mission is simple: to help the local music scene thrive by connecting artists, venues, and audiences through one comprehensive platform."
Raising Cane's River Center,N/A,https://raisingcanesrivercenter.com/,275 S River Rd,Welcome to the Raising Cane's River Center!,"Welcome to the Raising Cane's River Center website! We are delighted to invite you to explore our vibrant campus, which houses three exceptional venues for your entertainment and event needs. Immerse yourself in the diverse offerings of the Raising Cane's River Convention Center, experience world-class performances at the River Center Theatre for Performing Arts, and witness thrilling events at the Raising Cane's River Center Arena. We look forward to providing you with unforgettable experiences across our dynamic venues.
"
Ivar's Sports Bar & Grill,Ivarssportsbar@gmail.com,https://www.facebook.com/ivars.bar/,2954 Perkins Rd,Neighborhood sports bar,"Cold beer and hot crawfish at 3pm, we got the big ones"
The Tunnel,N/A,https://www.thetunnelbr.com/,201 Lafayette St,"A historic speakeasy located below the Hilton Capitol Center in Baton Rouge, LA, known for its connection to Huey P. Long's political life.","Below the Historic Hilton Capitol Center lies a secret tunnel that many have heard about, few have seen. The tunnel is steeped in history and played an important role during Huey P. Long‚Äôs political life. Completed in the late 20‚Äôs , the tunnel served as a connector between two hotels and allowed the opulent, full-service Heidelberg Hotel to create a similar experience for the smaller King hotel across the street including room service, valet, and laundry services.
Later, The Tunnel became known as ‚ÄúPeacock Alley‚Äù as it was adorned with ornate mosaic tiles and was also widely used by hotel guests and clientele. Huey P. Long worked and stayed in the Heidelberg throughout his career and even conducted business from his suite while under a looming impeachment from his Governorship. The media frenzy often caused the need for a quick escape, which The Tunnel provided."
Tropical Lounge,tropical_lounge@yahoo.com,https://www.facebook.com/p/TROPICAL-LOUNGE-BATON-ROUGE-100063547173665/,10455 Rieger Rd,AUTHENTIC PUERTO RICAN CUISINE,N/A
Bella Noche,N/A,https://www.facebook.com/bella.noche.1671,8190 Plank Rd,"Nightclub and bar offering food, beer, and cocktails in a casual atmosphere.","Come experience the best concerts, parties & events Baton Rouge offers. 3 bars, VIP sections & the largest dance floor in the city. Best Country music and Zydeco in town. Drink prices are as low as it gets, live music, DJ plays all different types of music after band is done performing. Club Bella Noche' *8190 Plank Rd @Harding Blvd*. 21+ ladies & gents. Book parties or event info, 225-916-2827 TwinTaylor ¬∑ Available Sections for tomorrow night."
Patio Lounge,N/A,N/A,8743 Jefferson Hwy,N/A,N/A
SKY LOUNGE,skylounge4564@gmail.com,SkyloungeBR.com,4564 Bennington Ave,"Sky Lounge is Baton Rouge's newest upscale bar. Offering great vibes, drinks, and delicious food.","Sky Lounge is Baton Rouge's newest upscale bar. Offering great vibes, drinks, and delicious food. Located on 4564 Bennington Avenue, Baton Rouge, LA, 70808."
Backstreet Lounge,N/A,N/A,845 Madeline Ct,N/A,N/A
BR.cade,events@brcade.com,https://brcade.com/,2963 Government St,Mid-city Baton Rouge's Adult Arcade and Bar.,"BR.cade is a Baton Rouge, Louisiana arcade & bar. Play all of your favorite classic arcade games ‚Äî and leave the quarters at home! BR.cade video arcade games are always on free play ‚Äî just pay cover at the door, and you‚Äôre in for the entire night. Free entry during happy hours Monday - Friday. BR.cade is an adult drinking environment ‚Äî under no circumstances are minors allowed."
The River Room,info@riverroombatonrouge.com,https://www.riverroombatonrouge.com,222 Laurel St,"Website for River Room, potentially a restaurant or event venue.","The website appears to be for a venue called River Room, offering menus, specials, and event booking. The site also includes a map."
Hayride Scandal,hello@hayridescandal.com,https://www.hayridescandal.com/,5110 Corporate Blvd,A new twist on legendary libations.,"Hidden away amid the bustle of Baton Rouge is Hayride Scandal.

A living, loving tribute to the heyday of mayhem. To our loyal patrons, we‚Äôre known for our intoxicating atmosphere, eclectic music, compelling beer list and tantalizing menu.

But, what we‚Äôre famous for is our whiskey-forward craft cocktails

Culled from original recipes and reimagined for the modern-day palate."
Radio Bar,N/A,https://theradiobar.com/,3079 Government St,"The Radio Bar is a bar located in Baton Rouge, Louisiana.",N/A
Royal Hookah Lounge & Bar,info@royalhookah.com,https://royalhookah.com/,5830 S Sherwood Forest Blvd,"Royal Hookah Lounge & Bar is located at 5830 S Sherwood Forest Blvd in Baton Rouge, LA. They can be contacted at (225) 465-3830 or info@royalhookah.com. They are open Monday-Saturday from 8:00pm ‚Äì 2:00am and Sunday from 6:00pm ‚Äì 12am.","The page provides contact information for Royal Hookah Lounge & Bar, including their address, phone number, email, and hours of operation. It also includes a contact form for inquiries."
Silly Rabbit Comedy Club,contact@sillyrabbitcomedyclub.com,https://www.sillyrabbitcomedyclub.com,9945 Airline Hwy,Where laughter is the best medicine,"The Silly Rabbit Comedy Club hosts upcoming events, open mic nights and private events. They also sell merch."
The R&B Cocktail Lounge,N/A,N/A,3151 College Dr,N/A,N/A
Olive Or Twist,info@oliveortwistbr.com,https://www.oliveortwistbr.com/,7248 Perkins Rd,"Contact information for Olive or Twist: Bar + Kitchen, including email, phone number, and physical address.","The contact page provides an email form for inquiries, the general business email (info@oliveortwistbr.com), the owner's email (josh@oliveortwistbr.com), phone number (225-456-2188), and physical address (2122 Perkins Palm Ave. Suite A, Baton Rouge, LA 70808). It also lists the business hours, brunch hours, and happy hour times."
Mother‚Äôs Lounge,mothersloungebr@gmail.com,https://www.mothersloungebr.com/,143 3rd St,"A Baton Rouge queer lounge. Operated by queer people, for queer people.","You‚Äôre invited to set the social scene ablaze with your fierce self-expression and dazzling uniqueness. Share a culinary experience with friends, sip on inspired libations, or dance the night away. Whatever your fantasy, make it a reality at Mother‚Äôs Lounge."
LA Threaux,info@lathreaux.com,https://www.lathreaux.com/,39359 Airline Plaza Pl,"Axe throwing venue in Gonzales, LA offering a fun and safe axe-perience with electronic scoring systems and BYOB.","LA Threaux offers axe throwing in a Prohibition-themed venue. They host special events like birthday parties and bachelorette parties, offering custom packages. Dedicated ""axe""perts ensure a smooth and fun experience while prioritizing safety. They are located in Gonzales, Louisiana and welcome walk-ins. They also offer membership options."
Dark 30,N/A,https://dark-30-wine-craftcocktail-bar.wheree.com/,151 3rd St,Sophisticated wine & craft cocktail bar in downtown Baton Rouge with an intimate ambiance and extensive selection of spirits.,"Dark 30 Wine & CraftCocktail Bar emerges as a sophisticated yet inviting oasis in the heart of downtown Baton Rouge, seamlessly blending timeless elegance with a vibrant atmosphere. This establishment captivates patrons with its dim lighting and thoughtfully curated interior design, creating an intimate ambiance ideal for unwinding after a long day. The extensive selection of spirits, including crafted cocktails and rare wines, caters to diverse palates, setting Dark 30 apart from typical bars. Unparalleled customer service further enhances the experience, making it a preferred destination for both seasoned connoisseurs and those seeking a refreshing evening out. The inviting and knowledgeable staff contribute to a satisfying journey through the world of luxury libations. The bar frequently hosts wine tastings, adding an educational twist to the experience. With its evolving drink selection and a commitment to exceptional service, Dark 30 continues to attract a loyal clientele, many of whom have made it part of their weekly routine. Located conveniently in downtown Baton Rouge, it boasts a clean, vibrant atmosphere, perfect for date nights or casual gatherings. The establishment's unique vibe and friendly bartenders create an environment where patrons feel valued and appreciated, making Dark 30 a hidden gem worth exploring."
The Bulldog,N/A,https://www.thebulldog.bar/contact-3-1-2/,4385 Perkins Rd,"Contact information for The Bulldog Baton Rouge, including address, phone number, bar hours, and kitchen hours. Includes links to their Facebook, Untappd, and Instagram pages.","THE BULLDOG BATON ROUGE
4385 Perkins Rd.
Baton Rouge, LA 70808
225-303-9400

BAR HOURS:
Mon-Sat 11:30 a.m. - 2:00 a.m.
Sun 11:30 a.m. - 12:00 a.m.

KITCHEN HOURS:
Sun-Tue 11:30 a.m. - 10:00 p.m.
Wed-Sat 11:30 a.m. - 12:00 p.m.

over 21 only"
Coop's on 621,N/A,https://www.facebook.com/coopson621/,38058 Hwy 621,The good time your momma warned you about!,N/A
Fred's in Tigerland,fredsintigerland@gmail.com,https://www.fredsintigerland.com/,1184 Bob Pettit Blvd,Featured in BuzzFeed's Top College Bars in America,N/A
The Main Lobby,N/A,https://www.themainlobbybr.com/,668 Main St,"The Main Lobby is an exquisite bar nestled in the heart of downtown Baton Rouge, Louisiana, with a hotel lobby-themed establishment.","Welcome to The Main Lobby, an exquisite bar nestled in the heart of downtown Baton Rouge, Louisiana. Immerse yourself in the unique ambiance of our hotel lobby-themed establishment, where the spirit of hospitality is woven into every detail.

Discover the warmth and elegance of our indoor bar and lounge area, meticulously designed to evoke the charm of a luxurious hotel foyer. As you ascend to our rooftop bar, be captivated by breathtaking views of downtown Baton Rouge, creating a backdrop of urban allure for your unforgettable experiences.

At The Main Lobby, we transcend the ordinary, offering a curated blend of classic and contemporary. Our commitment to excellence is reflected not only in our crafted cocktails and delectable offerings but also in the seamless fusion of nostalgia and modernity that defines our space.

Join us on a journey where each visit is a celebration of the art of hospitality. The Main Lobby invites you to indulge in the sophistication of our themed setting and create lasting memories in the heart of Baton Rouge. Welcome to a place where every sip, every moment, is an invitation to savor the essence of refined living. Cheers to the extraordinary at The Main Lobby!"
City Bar Baton Rouge,blake@citybarbatonrouge.com,https://www.225liveevents.com/venue/detail/City%20Bar%20Baton%20Rouge/45,333 3rd St,"Clean and fancy place to hang out
City Bar is a popular establishment in Baton Rouge
Experience the vibrant nightlife of Baton Rouge at City Bar
Come out to citybar and dance all night with DJ Swerve
Chad Hughes says he is moving the business to 333 Third Street","City Bar is a popular establishment in Baton Rouge, LA, known for its vibrant atmosphere and wide selection of drinks. Patrons can enjoy a casual night out
Experience the vibrant nightlife of Baton Rouge at City Bar, where dancing, live music, and local flavors come together for an unforgettable evening.
The popular Cajun-themed downtown bar, will soon be on the move. The bar will shift into the building located at 333 3rd St., which is currently inhabited
Come out to citybar and dance all night with DJ Swerve! Our doors open at 9:30 and we are eager to see all of your faces! See you there!
Chad Hughes says he is moving the business to 333 Third Street, which houses his City Bar Baton Rouge and is the former home of his Rio Tacos"
The Jefferson Lounge,catmama10339@gmail.com,https://www.facebook.com/dive.bar.br.jeffersonlounge/,4336 Floynell Dr,A eclectic bar you don't want your coworkers to know...,"The Jefferson Lounge, Baton Rouge, Louisiana. 1225 likes ¬∑ 3 talking about this ¬∑ 6084 were here. A eclectic bar you don't want your coworkers to know..."
The Vineyard,N/A,N/A,11914 Coursey Blvd,N/A,N/A
Dead Poet,N/A,N/A,623 E Boyd Dr,N/A,N/A
Tiger Tavern,N/A,https://www.instagram.com/tiger_tavern/,14505 Hwy 44,"Locally owned military bar with drive-thru service, non-smoking, no cover charge, 21+ only. Features 9 daiquiri machines and 52 craft beer taps.","Tiger Tavern is a locally owned military bar located in Gonzales, Louisiana. It is a non-smoking establishment with no cover charge and is restricted to patrons 21 years of age and older. The bar offers a unique drive-thru service. Inside, customers can enjoy a wide variety of beverages, including daiquiris from 9 different machines and a selection of 52 craft beers on tap. The tavern regularly hosts events such as karaoke, live music, and trivia nights."
Bianka Restaurants & Lounge,bianka@biankarestaurants.com,https://www.biankarestaurants.com/,11575 Coursey Blvd,"Bianka Restaurants, your culinary home in Metairie and Baton Rouge, where food and community thrive. We focus on fresh ingredients and inspired recipes, offering a vibrant menu that blends traditional and modern flavors. More than just a dining spot, Bianka is a place for friends and family to enjoy great food and memorable.","Bianka Restaurants is a culinary destination with locations in Metairie and Baton Rouge. They offer a vibrant menu blending traditional and modern flavors, made with fresh ingredients. Besides the food, they offer premium hookah experience, handcrafted cocktails, fine wines, and premium spirits."
Big D's Daiquiris,doubleddaiq@aol.com,https://www.facebook.com/pages/Double%20%22D%22%20Daiquiris/127267330677039/,30614 La Hwy 16,Sports bar specializing in daiquiris.,The daiquiri selection is extensive and full bar for other preferences. Daytime drive thru or night spot to pull up a seat at the bar.
Bayou Bar,N/A,https://m.facebook.com/bayoubar1947/,12496 Airline Hwy,"Bayou Bar is a dive bar located in Gonzales, Louisiana.","Bayou Bar is a dive bar that has a Facebook page with 1.3K likes and 1.6K followers. The bar is located at 12496 Airline Hwy, Gonzales, LA, United States, Louisiana. The phone number is (225) 644-2327. The price range is $$. 92% of reviewers recommend this location."
Boomerang Comedy Theater,Travis@BoomerangComedy.com,https://www.boomerangcomedy.com/,455 Hearthstone Dr,Live Improv & Stand Up Comedy Shows in Baton Rouge.,Boomerang Comedy Theater in Baton Rouge offers live comedy shows. Looking for a not-so-ordinary night out? Want to lift your spirits with some belly laughs? Check out the talented funny people on stage at Boomerang Comedy Theater in Baton Rouge!
The Colonel‚Äôs Club,info@thecolonelsclub.com,https://thecolonelsclub.com/,2857 Perkins Rd,"Located in the heart of the vibrant Overpass Merchants District, The Colonel‚Äôs Club is minutes from LSU and downtown Baton Rouge.","Planning an event or have a question, fill out the form on the contact page."
Mike's In Tigerland,N/A,https://www.yelp.com/biz/mikes-in-tigerland-baton-rouge,1125 Bob Petit,"Mike's In Tigerland is a sports bar located at 1125 Bob Petit, Baton Rouge, LA 70820.",N/A
The Fat Cat Saloon,Junction44@yahoo.com,https://www.facebook.com/fatcatsaloon/, 17326 Airline Hwy,Just a laid back neighborhood bar and live music venue.,N/A
Pelican to Mars: Pet Friendly Bar,welcome@pelicantomars.com,https://pelicantomars.com/,2678 Government St,"Pelican to Mars is a bar located in Baton Rouge, LA. It offers a wide selection of beers, tiki cocktails, and hosts events such as trivia nights, yoga, and a silent book club.","Pelican to Mars in Baton Rouge, LA, is a versatile venue offering a range of experiences. They have tailored events for all occasions and a happy hour from 3:00 PM to 7:00 PM. They are known for Rum forward - Craft Cocktails, Food truck and pop ups, Beer - Draft - Bottles - Cans - Craft Beer. Regular events include Let's Get Quizzical trivia night every Tuesday, Free Outdoor Yoga every Monday, and The Pelican to Mars Silent Book Club monthly on every third Wednesday. The venue also offers drinks to go and gift cards."
The Vintage,laurel@thevintagebr.com,https://www.thevintagebr.com/,333 Laurel St,"Coffee, Beignets, Bubbles, Bites.","The Vintage Restaurant in Baton Rouge offers coffee, beignets, wines, bubbles, and bites. They focus on providing an experience where people can relax, enjoy themselves, and connect with friends. They also offer local small-batch crafted coffees, beignet mix, t-shirts, mugs and tumblers."
Club Raggs,ClubRaggs225@gmail.com,clubraggs.com,2605 Plank Rd,"A popular nightlife destination in Baton Rouge, LA, offering a vibrant atmosphere for patrons to socialize and enjoy music and drinks.","Club Raggs is a popular nightlife destination in Baton Rouge, LA, offering a vibrant atmosphere for patrons to socialize and enjoy music and drinks."
Topgolf,N/A,https://topgolf.com/us/baton-rouge/,10955 N Mall Dr,"Topgolf Baton Rouge is the premier entertainment destination in Baton Rouge, LA. Enjoy year-round comfort in our hitting bays with cooling fans in the summer and heated bays in the winter, all with HDTVs in every bay and throughout our sports bar and restaurant.","Topgolf Baton Rouge offers a climate-controlled environment with hitting bays, HDTVs, a sports bar and restaurant, Toptracer games, a rooftop terrace, private event spaces, and golf lessons."
Dreams,clubdreams2083@yahoo.com,https://www.facebook.com/people/Club-Dreams-Baton-Rouge/100068695973962/,2083 Dallas Dr,Nightclub/Cocktail Lounge/Dance Club. Serves alcohol. Hosts live events.,"Nightclub/Cocktail Lounge/Dance Club. Serves alcohol. Hosts live events. Known as ""King of The Party Scene"" and the Kings of Monday Night Madness!!"
Bogie's Bar,bogiesbar@gmail.com,https://www.bogiesbr.us/,705 E Boyd Dr,"Bogie's Bar aims to provide one of the most fun, safe and memorable college bar atmospheres in Baton Rouge and to be a staple of the college experience.","Let's be honest, life is all about balance. Ying and Yang. You can't have one without the other. You can't have a Wednesday night, Vyvanse fueled cram fest for an exam without a Thursday night at Bogie's.  Without that balance, life falls apart. Let us be the the much needed release and distraction from the more boring aspects of college life.  We're here to provide one of the most fun, safe and memorable college bar atmospheres in Baton Rouge. We've become a staple of the college experience and look forward to  continuing in that tradition for years to come!"
Laguna Beach Daiquiris,Lagunabeachdaq@gmail.com,https://www.facebook.com/lagunabeachdaiquiris,8028 Florida Blvd,"Live Entertainment, Pool, Darts, Fully Stocked Bar",N/A
Uncle Earl's ,events@uncleearls.com,https://uncleearls.com/,3753 Perkins Rd,"Upscale bar offering an extensive drink menu, live entertainment and special events. Perfect for a night out, watching a game, or hosting an event.","Uncle Earl‚Äôs is the perfect spot for a night out, to catch a game on the patio or venue for your next event. Offering an extensive bar menu, live entertainment and special events in an upscale environment."
13 social,N/A,https://13social.com/,350 3rd St,13 Social is a dive bar located in Downtown Baton Rouge.,"13 Social is a dive bar located Downtown that offers happy hour specials such as $6 mules & margaritas from 4:00 PM to 9:00 PM, Monday through Sunday."
Mid City Beer Garden,N/A,https://www.midcitybeergarden.com/,3808 Government St,"50+ Beers on Tap, Specialty Frozen Drinks and Craft Cocktails alongside Classic Bar Fare, Fresh bites and Locally.","Mid City Beer Garden in Baton Rouge, LA. 50+ Beers on Tap, Specialty Frozen Drinks and Craft Cocktails alongside Classic Bar Fare, Fresh bites and Locally inspired Eats in the Heart of Mid City."
Edge,LBR.GuestExperience@pennentertainment.com,https://www.lbatonrouge.com/entertainment/edge/,777 Lauberge Ave,"Socialize in style and experience live entertainment at this upscale social music lounge. Edge is the perfect setting to enjoy a late nightcap, chill with friends or unwind after a long day.","Edge is a social music lounge at L'Auberge Baton Rouge. It offers live entertainment and is suitable for late night drinks or relaxing with friends. The venue has weekly events like Service Industry Night on Sundays with drink specials, Karaoke every Sunday evening, and On the Edge: The Ultimate Music Challenge every Thursday. Live entertainment is featured all weekend. The page also lists upcoming entertainment events with dates, times and descriptions, such as On the Edge: The Ultimate Music Challenge on April 10, After 8 on April 11, DJ Atomic on April 12, and Karaoke Party on April 13. There is no cover charge for any of the listed events.  Must be 21+ to enter. Hours: Thursday & Sunday: 5 p.m. - 12 a.m., Friday & Saturday: 5 p.m. - 3 a.m."
Jubans Restaurant and Bar,N/A,https://www.jubans.com/,3739 Perkins Rd,"Contact Jubans restaurant via phone, physical address or contact form.","The contact page provides a contact form, phone number (225-346-8422), and physical address (3739 Perkins Road, Baton Rouge, Louisiana 70808) for Jubans Restaurant. It also lists lunch, dinner, and brunch hours."
BLDG5,hello@bldg5.com,https://bldg5.com/,2805 Kalurah St,"Contact form for comments, questions, or concerns regarding reservations, live music bookings, or career opportunities.","Comments, questions or concerns in regards to reservations, live music bookings or career opportunities? Fill out the form below or email hello@bldg5.com to contact us and we‚Äôll be in touch as soon as we can."
